unique_id,tracking_code,borough,borough_code,cd,commdist,cb_label,type_br,type,priority,need,request,explanation,location,site_name,address,street_name,street_cross_1,street_cross_2,supporters_1,supporters_2,parent_tracking_code,agency_acronym,agency,agency_category_response,agency_response,geo_function,geom
2453,310202407C,Manhattan,1,10,110,MN 10,C,site,07,"Library facilities, equipment and programs (NYPL)",Other capital budget request for NYPL,Schomburg Center $7.9M Envelope rehabilitation and window replacement,Site Name: Schomburg Center for Research in Black Culture;   Street Name: 515 Malcolm X Blvd.,Schomburg Center for Research in Black Culture,515 Malcolm X Blvd.,Malcolm X Blvd.,,,,,,NYPL,37,1,This project was funded in a prior fiscal year and the scope is now underway.,geosupport_1B_address,0104000020E6100000010000000101000000D95EDD91387C52C05E89838346684440
2482,310202421E,Manhattan,1,10,110,MN 10,E,site,21,Educational programs,Other expense budget request for DOE,Provide laptop carts with Chrome books for 3rd- through 5th-grade students and iPads for K-2 students,"Site Name: Ps 200 James Mccune Smith;   Street Name: 2589 A C Powell Boulevard, Manhattan, New York, NY",Ps 200 James Mccune Smith,"2589 A C Powell Boulevard, Manhattan, New York, NY",A C Powell Boulevard,,,,,,DOE,40,8,Contact the Community Board Unit at OMB for information regarding this request.,geosupport_1B_address,0104000020E6100000010000000101000000291EDC0CE27B52C0E88AC07E76694440
208,105202409E,Bronx,2,05,205,BX 05,E, ,09,Senior center programs,Other NYPD facilities and equipment requests,"Feasibility Study for the Expansion of the Existing 46th Precinct.  Increase in personnel has made it extremely crowded in this old dilapidated and archaic building. This situation must be improved not only for the working police officers, but also for the surrounding community.",Site Name: 46th Precinct,46th Precinct,,,,,,,,NYPD,56,8,NYPD will formally request OMB to allow the Department of Citywide Administration Services (DCAS) to conduct a survey of available properties.,geosupport_1B_place,0104000020E6100000010000000101000000ECE631889B7952C035D029754E6D4440
527,109202439E,Bronx,2,09,209,BX 09,E,site,39,Public housing upgrades or renovations,Animal and pest control requests including reducing rat and mosquito populations,Re-painting of common areas needed,Site Name: Sack Wern Houses,Sack Wern Houses,,,,,,,,NYCHA,996,1,The agency will try to accommodate this issue within existing resources.,geosupport_1B_place,0104000020E6100000010000000101000000530438BD8B7752C0546EA296E6684440
2311,308202418C,Manhattan,1,08,108,MN 08,C, ,18,Programs to address other public health issues,"Reconstruct or upgrade a park or amenity (i.e. playground, outdoor athletic field)",Fund the reconstruction of Samuel Seabury Playground,Site Name: Samuel Seabury Playground,Samuel Seabury Playground,,,,,,,,DPR,846,8,Contact the Community Board Unit at OMB for information regarding this request.,geosupport_1B_place,0104000020E6100000010000000101000000204432E4D87C52C0CB82893F8A644440
1690,217202410C,Brooklyn,3,17,317,BK 17,C,site,10,NYPD staff and training resources,Renovate or upgrade a senior center,Installation of a commercial kitchen at Remsen Senior Center to provide hot meal preparation for seniors who attend the center.,"Street Name: 3304 Clarendon Road, Brooklyn, New York, NY",,"3304 Clarendon Road, Brooklyn, New York, NY",Clarendon Road,,,,,,DFTA,125,3,Approval of this request depends on sufficient Federal/State funds.,geosupport_1B_address,0104000020E6100000010000000101000000B9D3C465837C52C0794AF81653524440
2087,304202436E,Manhattan,1,04,104,MN 04,E, ,36,Traffic and traffic flow,Address traffic congestion,Study the creation of bus lane on 9th Avenue from 44th street to 57th street to increase the M11 reliability and consistency of its service.,Street Name: 9th Ave    Cross Street 1: 44th St  Cross Street 2: 44th St,,9th Ave,9th Ave,44th St,44th St,CHEKPEDS,,,DOT,841,8,Further study by the agency of this request is needed.,geosupport_2_street_name,0104000020E6100000010000000101000000F76429BD777F52C0560849D63E614440
1569,215202419E,Brooklyn,3,15,315,BK 15,E, ,19,Sanitation Enforcement,Provide more firefighters or EMS workers,"Brush Fire Unit #6 in Gerritsen Beach, Brooklyn, NY needs additional manpower during brush fire season.",Street Name: 52 Seba Ave,,52 Seba Ave,Seba Ave,,,,,,FDNY,57,8,Further study by the agency of this request is needed.,geosupport_1B_address,0104000020E61000000100000001010000000D8EB246037B52C013690C4F4A4B4440
3135,406202408C,Queens,4,06,406,QN 06,C, ,08,Garbage collection and recycling,"Create a new, or renovate or upgrade an existing public library (QL)","This request is to fund the full reconstruction of the Rego Park Library, 63 Drive and Austin Street. This request is also to ensure adequate space for library services in the community while construction is taking place.",Site Name: Rego Park Library;   Street Name: 91-41 63 Drive,Rego Park Library,91-41 63 Drive,63 Drive,,,,,,QPL,39,1,This project was funded in a prior fiscal year and the final design contract has been let.,geosupport_1B_address,0104000020E6100000010000000101000000AF21790D547752C07F6646A4185D4440
3661,502202402C,SI,5,02,502,SI 02,C, ,02,NYPD facilities and equipment,Provide technology upgrade,Provide funding for security cameras at Staten Island Technical High.  It is the only public high school on the island that doesn't have them. This is a priority that needs to be addressed especially in these unsafe times.,Site Name: Staten Island Technical High School;   Street Name: 485 Clawson Street,Staten Island Technical High School,485 Clawson Street,Clawson Street,,,,,,DOE,40,2,This project was funded in a prior fiscal year and the final design contract has been let.,geosupport_1B_address,0104000020E6100000010000000101000000532FF463708752C0CBEA93A1B9484440
3715,503202419C,SI,5,03,503,SI 03,C,site,19,"Park, buildings, and access improvements",Reconstruct or upgrade a building in a park,Olmstead Beil House requires stabilization and renovation,"Site Name: Olmsted Beil House Park;   Street Name: 4515 Hylan Boulevard, Staten Island, New York, NY",Olmsted Beil House Park,"4515 Hylan Boulevard, Staten Island, New York, NY",Hylan Boulevard,,,,,,DPR,846,5,This request cannot be funded in FY 2024. Resubmit for consideration in FY 2025.,geosupport_1B_address,0104000020E61000000100000001010000003EA06F611E8A52C01B72C5E815444440
460,109202415C,Bronx,2,09,209,BX 09,C,general,15,Transit Service,"Create a new, or renovate or upgrade an existing public library (NYPL)","$300,000 - Boiler : This project will replace the current boiler with an energy efficient model.",Site Name: Soundview Library,Soundview Library,,,,,,,,NYPL,37,9,Work on this project/program has either been completed or will be finished in FY 2024.,_dcp_facilities,0104000020E610000001000000010100000049455393397752C0A4AB4068CB684440
1457,213202435C,Brooklyn,3,13,313,BK 13,C, ,CS,Services for homebound older adults,Reconstruct or upgrade a building in a park,We need to reconstruct the Park Maintenance building on West 25th Street,Site Name: Park Maintenance Building;   Street Name: 3026 W 25th St,Park Maintenance Building,3026 W 25th St,W 25th St,,,,,,DPR,846,9,This project was funded in a prior fiscal year and the preliminary design contract has been let.,geosupport_1B_address,0104000020E6100000010000000101000000CE2FB040797F52C06B0474D044494440
1735,217202436C,Brooklyn,3,17,317,BK 17,C, ,36,Park maintenance and safety,Other capital budget request for SBS,"Increase availability of tech resources for use by community, by  building hubs along commercial/business strips.",Street Name: Church Avenue    Cross Street 1: Bedford Avenue  Cross Street 2: Bedford Avenue,,Church Avenue,Church Avenue,Bedford Avenue,Bedford Avenue,,,,SBS,801,8,Further study by the agency of this request is needed.,geosupport_2_street_name,0104000020E61000000100000001010000002DC7273C2C7D52C09007088F44534440
1996,303202417C,Manhattan,1,03,103,MN 03,C, ,17,After school programs,"Reconstruct or upgrade a park or amenity (i.e. playground, outdoor athletic field)",Baruch Playground: Renovate the full-size basketball court.,Site Name: Baruch Playground,Baruch Playground,,,,,,,,DPR,846,8,Contact the Community Board Unit at OMB for information regarding this request.,geosupport_1B_place,0104000020E6100000010000000101000000D2AA9674947E52C0BD00FBE8D45B4440
3311,501202415C,SI,5,01,501,SI 01,C,site,15,"Park, buildings, and access improvements",Repair or construct new curbs or pedestrian ramps,Repair or construct new curbs or pedestrian ramps - replace curbs on Colonial Court and Broadway.,,,,,,,,,,DOT,841,8,"Curb replacement/(re)construction requests should be directed to the Borough Commissioner. Upon receipt of a request, a site inspection will be conducted to determine eligibility for inclusion in a future contract.",Manual_Research,0104000020E61000000200000001010000002C6698FD558752C0C564A7D8195044400101000000CA05BC2E578752C0EBC535741E504440
2082,304202434C,Manhattan,1,04,104,MN 04,C, ,CS,Traffic and traffic flow,Renovate or upgrade a high school,"P.S.35M: Increase funding of $100,000.00 to upgrade library to include also computer and media lab.",Site Name: P35M at Manhattan High School;   Street Name: 317 West 52 Street,P35M at Manhattan High School,317 West 52 Street,West 52 Street,,,,,,DOE,40,6,Unable to prioritize funding for this project request at this time.,geosupport_1B_address,0104000020E610000001000000010100000078DDDA32197F52C018B82C1AD0614440
501,109202425C,Bronx,2,09,209,BX 09,C, ,25,Schools and educational facilities,Renovate other site component,Construct the Stevenson High School Performing Arts and Recreation Center.  Build the proposed center earmarked for this school.,Site Name: ADLAI E STEVENSON EDUC COMPLEX;   Street Name: 1980 LAFAYETTE AVENUE,ADLAI E STEVENSON EDUC COMPLEX,1980 LAFAYETTE AVENUE,LAFAYETTE AVENUE,,,,,,DOE,40,6,Unable to prioritize funding for this project request at this time.,geosupport_1B_address,0104000020E610000001000000010100000068648403C77652C0BD47FDDD24694440
420,108202436C,Bronx,2,08,208,BX 08,C, ,36,Other budget request,Renovate interior building component,HS 368- Upgrade School Library,"Site Name: Ms/hs 368 In Tech Academy;   Street Name: 2975 Tibbett Avenue, Bronx, New York, NY",Ms/hs 368 In Tech Academy,"2975 Tibbett Avenue, Bronx, New York, NY",Tibbett Avenue,,,,,,DOE,40,6,Unable to prioritize funding for this project request at this time.,geosupport_1B_address,0104000020E61000000100000001010000000C90B8DF557A52C020DE763783704440
2177,305202436C,Manhattan,1,05,105,MN 05,C, ,36,Affordable housing programs,New equipment for maintenance,New snow plow for Madison Sq Park,Site Name: Madison Square Park,Madison Square Park,,,,,Madison Square Park Consrvancy,,,DPR,846,8,Contact the Community Board Unit at OMB for information regarding this request.,geosupport_1B_place,0104000020E6100000010000000101000000A088450C3B7F52C01DCBBBEA015F4440
1,101202401C,Bronx,2,01,201,BX 01,C,site,01,Schools and educational facilities,Renovate or upgrade an elementary school,"Funding for construction of new first floor classroom flooring at PS25 located at 811 East 149th Street.    The first floor within PS25, the Bilingual School has deteriorated to such a degree that one classroom floor has buckled and created an unsafe environment for children seeking to learn daily.  The Board would like to see the immediate repair of this condition.",Site Name: PS25,PS25,,,,,,,,DOE,40,6,Unable to prioritize funding for this project request at this time.,geosupport_1B_place,0104000020E610000001000000010100000001FFB6E9F67952C02C4EF0F60A684440
632,111202411C,Bronx,2,11,211,BX 11,C,site,11,"Park, buildings, and access improvements","Provide a new or expanded park or amenity (i.e. playground, outdoor athletic field)","In order for the dogs and pet guardians of Williamsbridge Road to enjoy the Pelham Parkway dog run, some have to travel by car, take a bus or walk a 0.9 miles to get there, making the nearest dog run, not easily accessible.",Street Name: Bronx Park East    Cross Street 1: Williamsbridge Road,,Bronx Park East,Park East,Williamsbridge Road,,Paws on Pelham Parkway,,,DPR,846,8,Further study by the agency of this request is needed.,Manual_Research,0104000020E610000001000000010100000048C960FAB87752C0A8F82E3E816D4440
546,109202450C,Bronx,2,09,209,BX 09,C,site,50,Park maintenance and safety,"Provide a new or expanded park or amenity (i.e. playground, outdoor athletic field)",Request for composting toilets at Concrete Plant Park,Site Name: Concrete Plant Park,Concrete Plant Park,,,,,,,,DPR,846,8,Further study by the agency of this request is needed.,geosupport_1B_place,0104000020E61000000100000001010000007157AF22A37852C09F909DB7B1694440
2624,312202422C,Manhattan,1,12,112,MN 12,C,site,22,"Park, buildings, and access improvements",Renovate or upgrade an existing cultural facility,"Hispanic Society  renovations: roof, interior, terrace, adjacent sidewalks, & ADA compliance.",Site Name: The Hispanic Society of America,The Hispanic Society of America,,,,,,,,DCLA,126,3,"This project was funded in a prior fiscal year, but the scope is currently not fully funded. The Department of Cultural Affairs recommends this project be brought to the attention of your local elected official, i.e. Borough President or City Council member, to request additional funding.",Manual_Research,0104000020E61000000100000001010000002F08C589957C52C0EA57D3AEAB6A4440
1823,301202415C,Manhattan,1,01,101,MN 01,C, ,15,Economic development investments,"Roadway maintenance (i.e. pothole repair, resurfacing, trench restoration, etc.)","Reconstruct and restore Collister Alley between Laight and Beach Streets, a cobblestone street within CB1's historic district.",Street Name: Collister Street    Cross Street 1: Laight Street  Cross Street 2: Laight Street,,Collister Street,Collister Street,Laight Street,Laight Street,,,,DOT,841,8,Further study by the agency of this request is needed.,geosupport_2_street_name,0104000020E6100000010000000101000000F79F5A6B948052C083509B686C5C4440
1817,301202412C,Manhattan,1,01,101,MN 01,C,site,12,"Park, buildings, and access improvements","Roadway maintenance (i.e. pothole repair, resurfacing, trench restoration, etc.)","Reconstruct and restore Greenwich Street between Vestry Street and Hubert Street, a cobblestone street within CB's historic district.",Street Name: Greenwich Street    Cross Street 1: Vestry Street  Cross Street 2: Vestry Street,,Greenwich Street,Greenwich Street,Vestry Street,Vestry Street,,,,DOT,841,8,Further study by the agency of this request is needed.,geosupport_2_street_name,0104000020E6100000010000000101000000AEF6802C9E8052C0D11FBF3D845C4440
1841,301202424C,Manhattan,1,01,101,MN 01,C, ,24,Traffic and traffic flow,"Enhance park safety through design interventions, e.g. better lighting",Study the transition from gas lights at City Hall Park to LED,Site Name: City Hall Park,City Hall Park,,,,,,,,DPR,846,8,Contact the Community Board Unit at OMB for information regarding this request.,geosupport_1B_place,0104000020E61000000100000001010000000E6954E0648052C09F3A56293D5B4440
1881,301202444C,Manhattan,1,01,101,MN 01,C,site,CS,Schools and educational facilities,Provide a new or expand an existing high school,Construct a pool for the Harbor School aquatics program on Governors Island.,Site Name: New York Harbor School,New York Harbor School,,,,,,,,DOE,40,9,This request has already been funded.,Manual_Research,0104000020E61000000100000001010000007767BB684F8152C05AD233906A584440
1913,302202408C,Manhattan,1,02,102,MN 02,C,site,08,Cultural facilities and resources,Renovate or upgrade a high school,Allocate funds to upgrade outdoor space and /or add a green roof for education and outdoor recreation at Harvest Collegiate High School.,,,,,,,,,,DOE,40,6,This request is not recommended for funding.,Manual_Research,0104000020E61000000100000001010000003304882BB77F52C0F45F245F4A5E4440
1925,302202414C,Manhattan,1,02,102,MN 02,C, ,14,Zoning and land use,"Reconstruct or upgrade a park or amenity (i.e. playground, outdoor athletic field)",Allocate funds to install an irrigation system to the planted area in Seravalli Playground.,"Site Name: Seravalli Playground;   Street Name: Gansevoort Street, Manhattan, New York, NY",Seravalli Playground,"Gansevoort Street, Manhattan, New York, NY",Gansevoort Street,,,,,,DPR,846,8,Contact the Community Board Unit at OMB for information regarding this request.,geosupport_1B_place,0104000020E6100000010000000101000000B4C9E1934E8052C00536E7E0995E4440
1948,302202428E,Manhattan,1,02,102,MN 02,E, ,28,Other budget request,Address traffic congestion,"Allocate funds to address continuing congestion problems on E. 12th St., focusing on 12th bet. Broadway and 5th Ave. problem areas and placard parking abuses on 12th bet. University Pl. and Broadway. E. 12th St. is an essential ambulance route from Lenox Health Greenwich Village on 7th Ave. to hospitals on the east side.",Street Name: East 12th Street    Cross Street 1: Broadway  Cross Street 2: Broadway,,East 12th Street,East 12th Street,Broadway,Broadway,,,,DOT,841,8,Please contact the Borough Commissioner's office to discuss this request.,geosupport_2_street_name,0104000020E6100000010000000101000000A4DBB8646E7F52C0017409EDD95D4440
1994,303202416C,Manhattan,1,03,103,MN 03,C, ,16,After school programs,Other park maintenance and safety requests,Columbus Park: Include new fencing on east side along Mulberry street from Children's playground and Baxter Street. Permanent fencing is needed for safety.,Site Name: Columbus Park,Columbus Park,,,,,,,,DPR,846,8,Contact the Community Board Unit at OMB for information regarding this request.,geosupport_1B_place,0104000020E610000001000000010100000059315C1D008052C0DD0720B5895B4440
2010,303202424C,Manhattan,1,03,103,MN 03,C, ,24,NYPD staff and training resources,"Reconstruct or upgrade a park or amenity (i.e. playground, outdoor athletic field)","Funding is needed to redesign and renovate children's playground and water play area. Current playground only has one old, small play set for younger kids. Water area is non-functional with bad drainage.",Site Name: Corlears Hook Park,Corlears Hook Park,,,,,,,,DPR,846,8,Contact the Community Board Unit at OMB for information regarding this request.,geosupport_1B_place,0104000020E610000001000000010100000041BCAE5FB07E52C0228E75711B5B4440
2014,303202426C,Manhattan,1,03,103,MN 03,C, ,26,Transportation infrastructure,"Reconstruct or upgrade a park or amenity (i.e. playground, outdoor athletic field)","Restoration of the historic Schiff Fountain includes the replacement of missing granite and bronze elements, the cleaning and repointing of the existing granite, and the repair or replacement of the plumbing to make the foundation operable.",Site Name: Seward Park,Seward Park,,,,,,,,DPR,846,8,Contact the Community Board Unit at OMB for information regarding this request.,geosupport_1B_place,0104000020E6100000010000000101000000A7E7DD58507F52C0E964A9F57E5B4440
2691,312202455E,Manhattan,1,12,112,MN 12,E, ,55,Public housing upgrades or renovations,"Support local CBO's efforts to provide or expand district marketing, branding, and promotion",(Revised) Designated Marketing and Advertising space to support local businesses.,,,,,,,,,,SBS,801,8,Further study by the agency of this request is needed.,Manual_Research,0104000020E61000000100000001010000007F0D6EAE077C52C0B855EF53046D4440
2222,306202423C,Manhattan,1,06,106,MN 06,C, ,23,Economic development programs,"Reconstruct or upgrade a park or amenity (i.e. playground, outdoor athletic field)","More than 500 pickleball and handball players in the St. Vartan Park community are in need of renovated courts in the west end of the park on each side of the handball wall. The four pickleball courts require resurfacing to create regulation-size and level playing surfaces, and appropriate lines for both pickleball and handball. The current courts have cracks and, as such, have been causing player injuries. The surface material currently used for the adjacent basketball courts would be a more appropriate playing surface. As pickleball is the nation?s fastest growing sport, there is a significant increase in space and time needed for pickleball players. The addition of more court lights and/or lampposts would allow more community members to use the courts.",Site Name: St Vartan Park,St Vartan Park,,,,,,,,DPR,846,8,Contact the Community Board Unit at OMB for information regarding this request.,geosupport_1B_place,0104000020E610000001000000010100000089B48D3F517E52C0B1FCF9B6605F4440
2249,307202409C,Manhattan,1,07,107,MN 07,C, ,09,Educational programs,"Provide a new, or new expansion to, a building in a park",Build a Comfort Station in Riverside Park South at 62nd Street with a Department of Parks and Recreation Maintenance and Operation facility.  This facility was included in the designated plans for the Riverside South Park.  The final phase of the Park will include a multi-purpose playing field along with other amenities which will result in a strong need for this amenity.,Site Name: Riverside Park South,Riverside Park South,,,,,,,,DPR,846,8,Contact the Community Board Unit at OMB for information regarding this request.,geosupport_1B_place,0104000020E6100000010000000101000000C0232A54377F52C0DBA4A2B1F6634440
2354,309202414C,Manhattan,1,09,109,MN 09,C,site,14,Schools and educational facilities,Renovate or upgrade an existing cultural facility,"Provide funds to repair Hamilton Grange Senior Center damaged by flooding during Hurricane Ida, including kitchen renovation (with  new freezer, stove, counters, and working sink), repair of floors, and replacement of boiler",,,,,,,,,,DCLA,126,7,The organization does not meet City capital funding requirements for cultural projects.,Manual_Research,0104000020E6100000010000000101000000CEA192D98C7C52C0B23CE3C883694440
2463,310202412C,Manhattan,1,10,110,MN 10,C, ,12,Zoning and land use,Other public housing upgrades or renovations requests,Repair or replace broken entrance doors at St. Nicholas Houses NYCHA,Site Name: St. Nicholas Houses,St. Nicholas Houses,,,,,,,,NYCHA,996,7,More information is needed from the community board before making a funding decision. The community board should contact the agency.,geosupport_1B_place,0104000020E61000000100000001010000001C98DC28B27C52C0529B38B9DF674440
2439,309202464C,Manhattan,1,09,109,MN 09,C,site,CS,"Library facilities, equipment and programs (NYPL)","Improve access to a park or amenity (i.e. playground, outdoor athletic field)","Provide funds to complete the rebuilding of stairs at 133rd St. (St. Nicholas Park), repair and rebuild stairs at 140th and 129th St. (St. Nicholas Park), and 114th Street on the upper level of Morningside Park.",,,,,,,,,,DPR,846,8,Contact the Community Board Unit at OMB for information regarding this request.,Manual_Research,0104000020E610000004000000010100000094FD82C4DF7C52C042F9CEE8206844400101000000FADBF3D3B97C52C09B5DA7546B68444001010000001FE1B443957C52C03423D4C9076944400101000000E1AA34426F7D52C04870CB6CFE664440
2440,309202465C,Manhattan,1,09,109,MN 09,C,general,CS,"Park, buildings, and access improvements","Other requests for park, building, or access improvements",Provide funds to maintain sidewalks along the North and Southbound corridor  of Riverside Drive (bet. Grant's Tomb and the 125th St. Viaduct).,Street Name: Riverside Drive    Cross Street 1: West 122 Street  Cross Street 2: West 122 Street,,Riverside Drive,Riverside Drive,West 122 Street,West 122 Street,,,,DPR,846,8,Contact the Community Board Unit at OMB for information regarding this request.,geosupport_2_street_name,0104000020E6100000010000000101000000DF58236CA87D52C0FEA720CB0B684440
2471,310202416C,Manhattan,1,10,110,MN 10,C, ,16,Direct business services,Install security cameras or make other safety upgrades,Repair or replace security camera system at Drew Hamilton Houses,Site Name: Drew Hamilton Houses,Drew Hamilton Houses,,,,,,,,NYCHA,996,4,In order to fund this initiative contact local elected officials for appropriations.,geosupport_1B_place,0104000020E6100000010000000101000000051A6CEA3C7C52C0F4FDD478E9684440
2473,310202417C,Manhattan,1,10,110,MN 10,C, ,17,Workforce development,Renovate or upgrade NYCHA community facilities or open space,Repair or replace broken stairwell exit doors at Drew Hamilton NYCHA,Site Name: Drew Hamilton Houses,Drew Hamilton Houses,,,,,,,,NYCHA,996,7,In order to fund this initiative contact local elected officials for appropriations.,geosupport_1B_place,0104000020E6100000010000000101000000051A6CEA3C7C52C0F4FDD478E9684440
2616,312202418C,Manhattan,1,12,112,MN 12,C, ,18,Transit Infrastructure,"Provide a new or expanded park or amenity (i.e. playground, outdoor athletic field)",Add ADA-compliant bathroom in Highbridge Park by ballfields & Water Tower.,"Site Name: Highbridge Park;   Street Name: Amsterdam Avenue, Manhattan, New York, NY",Highbridge Park,"Amsterdam Avenue, Manhattan, New York, NY",Amsterdam Avenue,,,,,,DPR,846,8,Contact the Community Board Unit at OMB for information regarding this request.,geosupport_1B_place,0104000020E61000000100000001010000005B22179CC17B52C0D9092FC1A96B4440
2680,312202450C,Manhattan,1,12,112,MN 12,C, ,50,Schools and educational facilities,Reconstruct or upgrade a building in a park,"Asbestos abatement and restoration of ""Building D"" in Ft. Tryon Park for security presence.","Site Name: Fort Tryon Park;   Street Name: Margaret Corbin Drive, Manhattan, New York, NY",Fort Tryon Park,"Margaret Corbin Drive, Manhattan, New York, NY",Margaret Corbin Drive,,,,,,DPR,846,8,Contact the Community Board Unit at OMB for information regarding this request.,geosupport_1B_place,0104000020E610000001000000010100000079CDAB3AAB7B52C019AC38D55A6E4440
