unique_id,tracking_code,borough,borough_code,cd,commdist,cb_label,type_br,type,need,request,explanation,location,site_name,address,street_name,street_cross_1,street_cross_2,agency_acronym,agency,agency_category_response,agency_response,geo_function,geom
3038,404202424C,Queens,4,04,404,QN 04,C, ,Transit Infrastructure,Provide more housing for medium income households,"Community Board 4 has seen a very steady influx of new residents in the last few years, and will only continue to grow at a steady pace. An emphasis throughout the district is being put into low income housing, however, financial burden does not pertain strictly to low income households. Requesting funding to survey, obtain land, and eventually build an affordable housing facility for medium range income within the district.",,,,,,,HPD,806,2,This request includes more than one proposal.  Funding for part is recommended.,NO LOCATION DATA,
3044,404202427C,Queens,4,04,404,QN 04,C,street,Sewage and flooding,Provide technology upgrade,"Students within our district strongly need tech upgrades such as whiteboards, laptops, calculators, tablets, etc especially with the current pandemic, and remote learning.  We are aware that the newer schools came with a lot of these tech upgrades already, so focus should be put towards the remaining pre-existing schools. Additionally, conversations should begin towards Windows based desktops vs the more sensitive, less compatible Mac based tablets.",,,,,,,DOE,40,8,Contact the Community Board Unit at OMB for information regarding this request.,NO LOCATION DATA,
3048,404202429C,Queens,4,04,404,QN 04,C,street,"Park, buildings, and access improvements",Other cultural facilities and resources requests,"The community of Elmhurst is rich in cultural history with many buildings dating back to the 1700?s.  One of the first religious buildings in Newtown was the old St. James Episcopal Church, and is Elmhurst?s oldest remaining structure and New York City landmark.  Other distinctive buildings in the community include Newtown HS, the Elks Lodge, and Dutch Reformed Church.  Not only does the community boast architecture from the 1800s, but it also houses ancient artifacts dating back from an early African - American cemetery. We are requesting a museum or space in the Elmhurst community to showcase and preserve the past of a community with an abundance of historical significance for generations to come.",,,,,,,DCLA,126,7,"More information is required, specifically each request must be tied to one organization, and mention a specific project.",NO LOCATION DATA,
3054,404202435C,Queens,4,04,404,QN 04,C, ,NYPD staff and training resources,Provide new or increase number of sanitation trucks and other equipment,"We are requesting dual-bin trucks to improve our community?s quality of life. Elmhurst and Corona residents are unhappy with the apparent increase in curbside trash and the increased number of rats, health risks, safety hazards, and odor it causes. Issuing dual-bin trucks to our community will allow recyclables to be collected efficiently, especially with the start of the Curbside Composting program on October 3rd, and reduce the need for two trash pick-ups. This swift cleanup will solve the problems our residents face while saving NYC time and money. OMB supports this expenditure.",,,,,,,DSNY,827,1,The agency will try to accommodate this issue within existing resources.,NO LOCATION DATA,
3055,404202436C,Queens,4,04,404,QN 04,C,street,Environmental protection,Repair or upgrade subway stations or other transit infrastructure,The district of QCB4 is home to 2 main transportation hubs (74 St .Roosevelt Avenue and Woodhaven Boulevard / Hoffman Drive) Requesting that the systematic upgrade of bus shelters specifically with the implementation of digital bus signs continue through FY24.,,,,,,,NYCTA,998,7,More information is needed from the community board before making a funding decision. The community board should contact the agency.,NO LOCATION DATA,
3056,404202437C,Queens,4,04,404,QN 04,C, ,Sewage and flooding,"Improve access to a park or amenity (i.e. playground, outdoor athletic field)","Requesting funding for the renovation of Answer Triangle (Roosevelt Avenue and Aske Street).  The center of this park along the corridor of Roosevelt has been sinking for some time now, and is currently below ground level causing flooding. Additionally, the sidewalk surrounding the park is heavily damaged. Funding can be allocated to include better shrubbery, seating, and elevation / improvements to the existing land, as this park can be included as part of a ""rest stop"" along Roosevelt Avenue for those touring the local neighborhood.",,,,,,,DPR,846,5,Parks Department funds are insufficient for this purpose. We recommend this request be brought to the attention of your Council Members.,NO LOCATION DATA,
3058,404202439C,Queens,4,04,404,QN 04,C, ,Building code and zoning enforcement,Repair or provide new street lights,"In recognition of the historical significance of the community, we are requesting that street lights serving Corona Avenue from Broadway to Sautell Ave. be replaced with ""Type M Luminaire & Pole"", which were first introduced in 1908 and designed to light wide street corners.",,,,,,,DOT,841,4,"Standard street lights can only be replaced if the request is accompanied by funding to cover all equipment, construction, and additional electrical costs and a Maintenance Agreement is signed with a City Chartered organization willing and able to pay for the associated maintenance cost-i.e. Business Improvement District.",NO LOCATION DATA,
3060,404202441C,Queens,4,04,404,QN 04,C, ,Street and lot cleaning,Other capital budget request for DYCD,"The low allocation of funds within CB4 is surprising considering SD 24 is currently the most overcrowded in the city. There is a need for after school programming for adolescents grades 6-8 who at this stage in their lives need more aggressive mentoring and help with school work especially with the current pandemic, and the effects that staying indoors for extended periods of time can have on our youth's psyche.",,,,,,,DYCD,260,9,DYCD has increased funding in this service area.,NO LOCATION DATA,
3062,404202443C,Queens,4,04,404,QN 04,C, ,After school programs,"Build or expand affordable work or research lab spaces related to key industries, such as film/tv, advanced manufacturing, life science and healthcare, renewable energy and freight maritime","As businesses begin to reopen in the wake of COVID19, consideration should be put into small businesses that are the backbone of our local economy. Studies show that immigrants have a higher rate of business ownership than non-immigrants, with roughly one out of ten immigrant workers owning a business. While our community has made significant progress supporting street vendors (through community based organizations and local elected officials supporting positive legislation), we still lack a clear pipeline for street vendors to open a small business. Our community would benefit from funding allowing us to establish a small business incubator that provides mentorship, training, and education specifically regarding post epidemic safety protocols.",,,,,,,EDC,802,8,Securing funding for this request is outside of EDC's jurisdiction; please contact the agency if you have any questions about the EDC budget process.,NO LOCATION DATA,
3113,405202425C,Queens,4,05,405,QN 05,C, ,Services to support low-income New Yorkers,Other transit infrastructure requests,"Reconstruct the DeKalb Avenue, Halsey Street and Jefferson Street Train Stations (BMT- L Line).   Only the Halsey Street Train Station is in Queens, but many of our Ridgewood residents either use these stations, or would use them, if they were not so deteriorated and if they were more inviting. There is increased development along the Brooklyn/Queens border, and we need to ensure that these train stations are modernized and rehabilitated. We are informed that, in 2012, the Halsey St. station had the largest percentage growth in passengers of any ""L"" train stations.","Site Name: DeKalb Av., Halsey St. & Jefferson St. Stations","DeKalb Av., Halsey St. & Jefferson St. Stations",,,,,NYCTA,998,7,More information is needed from the community board before making a funding decision. The community board should contact the agency.,GEOCODING FAILED,
3117,405202431C,Queens,4,05,405,QN 05,C, ,Services for homebound older adults,Reconstruct streets,"RECONSTRUCT 75th STREET FROM ELIOT AVENUE TO JUNIPER BOULEVARD NORTH, IN MIDDLE VILLAGE   Although the bureau of Highways crews have resurfaced 75th Street in the past 10 years, it is quite evident that this street needs reconstruction. Due to extensive roadway and street settlement, resurfacing is but a short-term solution. The portion of the roadway adjacent to the Learning Tree Day Care Center is higher then the sidewalk, causing unhealthy water accumulation.",Street Name: 75th Street    Cross Street 1: Eliot Avenue  Cross Street 2: Juniper Blvd. North,,75th Street,75th Street,Eliot Avenue,Juniper Blvd. North,DOT,841,7,"Based on our on-site inspection of the roadway condition, this location does not warrant reconstruction.  Please withdraw this request from budget submissions.",GEOCODING FAILED,
3071,405202401C,Queens,4,05,405,QN 05,C, ,Street trees and forestry services,Other capital budget request for DEP,"REDESIGN AND RECONSTRUCT THE SEWER SYSTEM IN PORTIONS OF THE CB5Q AREA HAVING THE WORST FLOODING CONDITIONS   The main emphasis now needed is to achieve solutions to roadway and basement flooding during rainstorms for parts of the Glendale community, especially in the area of Cooper Avenue at 76 Street, and along 77 Avenue, from 76 Street to 88 Street (SE 877). Larger sewers are needed to prevent future household flooding from heavy rain storms. During the storm of 9/1/2021, homes along 77 Avenue were overwhelmed by more than 2 feet of water in basements.",Street Name: 77 Avenue    Cross Street 1: 76 Street  Cross Street 2: 88 Street,,77 Avenue,77 Avenue,76 Street,88 Street,DEP,826,9,This project is included in the ten-year plan.,GEOCODING FAILED,
2975,405202427C,Queens,4,05,405,QN 05,C, ,Transit Infrastructure,Rehabilitate bridges,"RECONSTRUCT AND WIDEN THE EAST SIDE OF 80TH STREET, ON THE 80TH STREET BRIDGE, OVER THE LIRR, IN GLENDALE AND REVIEW THE STRUCTURAL STABILITY OF THE BRIDGE   Pedestrians have to walk a narrow sidewalk to get to and from the Atlas Park Shopping Center. The roadway over the 80th Street Bridge in Glendale should be wide enough to allow sidewalk expansion, and reduce dangerous conditions for pedestrians.",Street Name: 80 street    Cross Street 1: Cooper Avenue  Cross Street 2: 78 Avenue,,80 street,80 street,Cooper Avenue,78 Avenue,DOT,841,8,Please contact the Borough Commissioner's office to discuss this request.,GEOCODING FAILED,
2974,405202426C,Queens,4,05,405,QN 05,C, ,Zoning and land use,Provide a new or expand an existing high school,"CONSTRUCT NEW HIGH SCHOOLS IN QUEENS, INCLUDING A NEW VOCATIONAL HIGH SCHOOL, AND PERFORM CAPITAL UPGRADES TO SCHOOL BUILDINGS    This request includes Construction of New High Schools in Queens, including a new vocational high school, considering that many youth are very well suited to a career in electrical, plumbing and other trades and there is significant demand for skilled workers in many trades. For years there has been a shortage of high schools locally for Queens's teenagers. There is also an ongoing need to renovate existing school buildings.",Street Name: Cooper Avenue,,Cooper Avenue,Cooper Avenue,,,DOE,40,9,Community District is located in borough with identified HS seat need. Location for school will be based on site and funding availability.,GEOCODING FAILED,
3109,405202423C,Queens,4,05,405,QN 05,C,street,Transportation infrastructure,Reconstruct streets,"RECONSTRUCT FRESH POND ROAD FROM MYRTLE AVENUE TO ELIOT AVENUE, AND PROVIDE TRAFFIC FACILITATION IMPROVEMENTS   Fresh Pond Road is a major north/south artery in the CB5Q area. This request includes planning/implementation of better traffic facilitation, by cutting into curb areas (where possible) to enable trucks and buses to get to the curb. For the short term, we succeeded in convincing NYC DOT Queens Street Maintenance supervisors to resurface Fresh Pond Road 3 years ago.",Street Name: Fresh Pond Road    Cross Street 1: Myrtle Avenue  Cross Street 2: Eliot Avenue,,Fresh Pond Road,Pond Road,Myrtle Avenue,Eliot Avenue,DOT,841,7,Please contact the Borough Commissioner's office to discuss this request.,GEOCODING FAILED,
3074,405202404C,Queens,4,05,405,QN 05,C, ,Traffic and traffic flow,"Improve traffic and pedestrian safety, including traffic calming","MAKE CAPITAL IMPROVEMENTS TO IMPROVE PEDESTRIAN AND VEHICLE SAFETY ON GRAND AVENUE AT 69 STREET, AT THE GRAND AVENUE/LIE EASTBOUND SERVICE ROAD, AND AT THE 69 STREET/LIE SERVICE ROAD INTERSECTIONS IN MASPETH   Studies have been conducted but physical improvements have still not been performed to improve pedestrian and vehicular safety at several Maspeth intersections. The most dangerous of these are: Grand Avenue at 69th Street, Grand Avenue at the LIE Eastbound Service Road and 69th Street at the LIE Service Roads.",Street Name: Grand Ave    Cross Street 1: 69th Street  Cross Street 2: LIE Service Roads,,Grand Ave,Grand Ave,69th Street,LIE Service Roads,DOT,841,7,Please contact the Borough Commissioner's office to discuss this request.,GEOCODING FAILED,
3086,405202410C,Queens,4,05,405,QN 05,C, ,NYPD staff and training resources,Rehabilitate bridges,"REPLACE THE EXISTING BRIDGE ON GRAND AVENUE OVER NEWTOWN IN MASPETH   Due to the deteriorated conditions of this 2-lane bridge, which only worsened in the aftermath of Super Storm Sandy in 2012, and the increased vehicular traffic over this important bridge, replacement of the existing bridge over Newtown Creek in the Maspeth Industrial Area is needed. The Grand Street Bridge is too narrow to accommodate trucks and buses in opposite directions. Truckers and bus drivers have to wait for traffic to pass in the opposite direction, posing dangerous conditions and traffic delays. This vital bridge is deteriorating to the point where it is closed for repairs consistently.  We look forward to this important bridge replacement beginning by 2026.",Street Name: Grand Street    Cross Street 1: 47 Street  Cross Street 2: 47 Street,,Grand Street,Grand Street,47 Street,47 Street,DOT,841,1,The agency will accommodate this issue within existing resources.,GEOCODING FAILED,
3105,405202421C,Queens,4,05,405,QN 05,C,street,Transportation infrastructure,Other transportation infrastructure requests,"IMPROVE THE MYRTLE AVENUE COMMERCIAL STRIP, FROM FRESH POND ROAD TO 82 ST. IN GLENDALE   Improvements needed include: replacement of damaged curbs and sidewalks, including traffic facilitation and pedestrian safety upgrades.",Street Name: Myrtle Avenue    Cross Street 1: Fresh Pond Road  Cross Street 2: 82 Street,,Myrtle Avenue,Myrtle Avenue,Fresh Pond Road,82 Street,DOT,841,2,Please contact the Borough Commissioner's office to discuss this request.,GEOCODING FAILED,
3080,405202407C,Queens,4,05,405,QN 05,C, ,Transportation infrastructure,Repair or construct new curbs or pedestrian ramps,"RECONSTRUCT SIDEWALKS, CURBS AND PEDESTRIAN RAMPS ALONG MYRTLE AVENUE, FROM FRESH POND ROAD TO WYCKOFF AVENUE, IN RIDGEWOOD    Sidewalks, with brick pavers, along Myrtle Avenue in Ridgewood have deteriorated causing tripping hazards. One of the main problems has been tree roots lifting the bricks and the sidewalk flags. The last major improvement was in 1984/1985. This section of Myrtle Avenue receives extensive pedestrian traffic with people from Ridgewood and nearby communities shopping on Myrtle Avenue. Funding is needed to physically improve safety conditions along this section of Myrtle Avenue.  There may also be a need to replace the main city sewer and water main in this section of Myrtle Avenue.",Street Name: Myrtle Avenue    Cross Street 1: Fresh Pond Road  Cross Street 2: Wyckoff Avenue,,Myrtle Avenue,Myrtle Avenue,Fresh Pond Road,Wyckoff Avenue,DOT,841,2,The agency will try to accommodate this issue within existing resources.,GEOCODING FAILED,
3078,405202406C,Queens,4,05,405,QN 05,C, ,Sanitation Enforcement,Reconstruct streets,"RECONSTRUCT PALMETTO STREET FROM SAINT NICHOLAS AVENUE TO SENECA AVENUE, AND FROM ONDERDONK AVENUE TO FOREST AVENUE IN RIDGEWOOD    Palmetto Street serves as an important local artery, especially for numerous bus lines that take passengers to and from the Myrtle and Wyckoff Avenues Transit Hub. Engineered resurfacing at a minimum is needed along Palmetto Street, from St. Nicholas Avenue to Seneca Avenue, as the roadway is in disrepair. Street conditions are complicated by the fact that the pillars supporting the elevated ""M"" Train are located in the bed of the roadway.",Street Name: Palmetto Street    Cross Street 1: Saint Nicholas Avenue  Cross Street 2: Forest Avenue,,Palmetto Street,Palmetto Street,Saint Nicholas Avenue,Forest Avenue,DOT,841,7,Please contact the Borough Commissioner's office to discuss this request.,GEOCODING FAILED,
3116,405202430C,Queens,4,05,405,QN 05,C, ,Transit Infrastructure,Other transportation infrastructure requests,"PROVIDE HISTORIC LIGHTING AND RESTORE DETERIORATED CURBING ALONG FRED HALLER'S UNION TURNPIKE MALL (Myrtle Avenue to Woodhaven Boulevard).    Union Turnpike is a wide residential roadway, and is one of the gateways into CB5Q. Improvements needed include new curbing, tree root pruning, and new decorative historic LED lighting. This project has been partially funded, and new pavement has been installed along the center median.",Street Name: Union Turnpike    Cross Street 1: Woodhaven Boulevard  Cross Street 2: Myrtle Avenue,,Union Turnpike,Union Turnpike,Woodhaven Boulevard,Myrtle Avenue,DOT,841,6,"Standard street lights can only be replaced if the request is accompanied by funding to cover all equipment, construction, and additional electrical costs and a Maintenance Agreement is signed with a City Chartered organization willing and able to pay for the associated maintenance cost-i.e. Business Improvement District.",GEOCODING FAILED,
3082,405202408C,Queens,4,05,405,QN 05,C, ,Homelessness prevention programs,Reconstruct streets,"RECONSTRUCT WYCKOFF AVENUE, FROM FLUSHING AVENUE TO COOPER AVENUE IN RIDGEWOOD (Queens and Brooklyn) - HWK 876.  Wyckoff Avenue, on the Brooklyn-Queens border, is an important neighborhood artery with significant commercial development. This request is for reconstruction of the deteriorated roadway and sidewalks, installation of new sewer lines and water mains from Flushing Avenue to Cooper Avenue in Ridgewood. We look forward to this vital project beginning in 2025. Part of Wyckoff Avenue is in the CB5Q area, and much of it is in Brooklyn Community District 4.",Street Name: Wyckoff Avenue    Cross Street 1: Flushing Avenue  Cross Street 2: Cooper Avenue,,Wyckoff Avenue,Wyckoff Avenue,Flushing Avenue,Cooper Avenue,DOT,841,1,This project was funded in a prior fiscal year and the final design contract has been let.,GEOCODING FAILED,
3092,405202413C,Queens,4,05,405,QN 05,C, ,Wastewater treatment system,Other street trees and forestry services requests,"PROVIDE NEW STREET TREE PLANTINGS AND PROVIDE FUNDING FOR STUMP REMOVALS, PLANTING OF REPLACEMENT TREES, AND STREET TREE REMOVALS    The tornado that devastated portions of the CB5Q area on 9/16/2010 resulted in the loss of several hundred trees completely, and has necessitated removal of dead trees, along with street tree stumps. Funding is needed to replace uprooted trees, for the removal and replacement of dead trees, for the removal of street tree stumps and for emergency pruning of dangerous street tree conditions. Hurricane Irene uprooted numerous additional trees.  CB5Q has, for decades, pushed for new street tree plantings, with much success. Street trees reduce air pollution and beautify city streets. Asthma and other respiratory problems are a great concern.",,,,,,,DPR,846,5,Parks Department funds are insufficient for this purpose. We recommend this request be brought to the attention of your Council Members.,NO LOCATION DATA,
3118,405202432C,Queens,4,05,405,QN 05,C, ,Affordable housing programs,"Provide a new, or new expansion to, a building in a park","ESTABLISH A COMMUNITY/RECREATION CENTER AT A SITE IN MASPETH   The communities comprising District 5, Queens do not have a large indoor public space, other than schools, for recreation and community activities. This request is to build a new facility in Maspeth, preferably on a vacant parcel of land.",,,,,,,DPR,846,7,Further study by the agency of this request is needed.,NO LOCATION DATA,
3119,405202433C,Queens,4,05,405,QN 05,C, ,Services to support low-income New Yorkers,"Reconstruct or upgrade a park or amenity (i.e. playground, outdoor athletic field)","Provide Funding for the Establishment of a Dog Run in District 5, Queens.   Residents have advocated for the establishment of a more permanent dog run in Juniper Valley Park in Middle Village. Recent cost estimates are projected to be somewhere in the range of $750,000. It is questionable whether there is sufficient open space to accommodate a dog run inside Juniper Valley Park since there are so many competing uses there including seven (7) ball fields, a running track, two (2) children's playgrounds, a football/soccer field, bocce, tennis and basketball courts, and a roller hockey rink, in addition to landscaped areas. The CB5Q Parks Committee has looked at possibilities for a dog run in this park and at other locations.",,,,,,,DPR,846,7,Further study by the agency of this request is needed.,NO LOCATION DATA,
3084,405202409C,Queens,4,05,405,QN 05,C, ,Housing oversight and emergency programs,Other capital budget request for DEP,"CONTINUE A COMPREHENSIVE STUDY OF THE SEWER SYSTEM IN THE COMMUNITY BOARD 5, QUEENS AREA AND THROUGHOUT QUEENS COUNTY, CONSIDERING FLOODING PROBLEMS AND ANTICIPATED FUTURE GROWTH   A thorough sewer system study, including mapping and an analysis of flow patterns has begun, but needs to be completed in the very near future, so that street flooding and basement sewer backup problems can be reduced. The sewer system links our communities and those of other community board areas.",,,,,,,DEP,826,1,Further study by the agency of this request is needed.,NO LOCATION DATA,
2968,405202402C,Queens,4,05,405,QN 05,C,street,Transportation infrastructure,"Evaluate a public location or property for green infrastructure, e.g. rain gardens, stormwater greenstreets, green playgrounds","PROVIDE STORMWATER RUNOFF MITIGATION  This request is for installation of green infrastructure, to reduce the amount of storm water runoff that has caused home and street flooding conditions, and to prevent storm water from overwhelming the city sewer system.. Examples include rain gardens, also known as bioswales, and permeable pavement installations.",,,,,,,DEP,826,8,Further study by the agency of this request is needed.,NO LOCATION DATA,
3149,406202415C,Queens,4,06,406,QN 06,C, ,Substance misuse prevention programs,"Improve accessibility of transit infrastructure, by providing elevators, escalators, etc.",This request is to fund the installation of an elevator and related ADA improvements at Forest Hills Long Island Railroad Station.,Site Name: Forest Hills LIRR Station,Forest Hills LIRR Station,,,,,NYCTA,998,7,More information is needed from the community board before making a funding decision. The community board should contact the agency.,GEOCODING FAILED,
3167,406202424C,Queens,4,06,406,QN 06,C, ,Sewage and flooding,Other transportation infrastructure requests,"This request is to fund the planting of trees, shrubbery and other vegetations along the Jackie Robinson Parkway within CB 6 to serve as a sound barrier from highway traffic.",,,,,,,DOT,841,8,More information is needed from the community board before making a funding decision. The community board should contact the agency.,NO LOCATION DATA,
3169,406202425C,Queens,4,06,406,QN 06,C, ,NYPD facilities and equipment,Repair or upgrade subway stations or other transit infrastructure,This request is for the installation of security cameras at all subway stations in CB 6,,,,,,,NYCTA,998,7,"For information regarding the status of this Request, contact the Transit Authority directly at telephone number 646-252-2660.",NO LOCATION DATA,
3165,406202423C,Queens,4,06,406,QN 06,C,street,Environmental protection,Invest in infrastructure that will support growth in commercial business districts,This request is for business district signage directing people to the following locations: 1. Austin Street 2. Metropolitan Avenue 3. FH LIRR 4. FH Stadium 5. Subway Station (s) 6. Other locations as needed,,,,,,,EDC,802,8,Securing funding for this request is outside of EDC's jurisdiction; please contact the agency if you have any questions about the EDC budget process.,NO LOCATION DATA,
3153,406202417C,Queens,4,06,406,QN 06,C, ,Affordable housing programs,New equipment for maintenance,"This request is for funding the purchase of a Gator XVU855MS for use at CB6 parks. This equipment is necessary for improved maintenance, cleanliness, and safety for all parks. (We currently share a truck with another community district and this is limiting for all parks in both communities.)",,,,,,,DPR,846,3,Parks Department funds are insufficient for this purpose. We recommend this request be brought to the attention of your Council Members.,NO LOCATION DATA,
