unique_id,tracking_code,borough,borough_code,cd,commdist,cb_label,type_br,type,need,request,explanation,location,site_name,address,street_name,street_cross_1,street_cross_2,agency_acronym,agency,agency_category_response,agency_response,geo_function,geom
1427,213202420C,Brooklyn,3,13,313,BK 13,C,general,Tax and other incentives programs and financing support,Other NYPD facilities and equipment requests,"Sufficient funds are requested to immediately allocate additional bicycles, Segways and Gators to the 60th Precinct to reduce reliance on heavy motorized vehicles, to enhance mobility and to increase public safety. Our goal is to reduce the volume of heavy motorized vehicles driven on the boardwalk which creates preventable vehicular-pedestrian conflicts, significantly adds to the wear-and-tear maintenance requirements for the boardwalk, and takes away valuable public space needed for social distancing.",,,,,,,NYPD,56,5,The NYPD is working with the Mayor's Office of Management and Budget in order to secure additional funds to maintain lifecycle replacement of its current fleet.  Supplemental funding would be needed if there was a desire to increase this count even further.,NO LOCATION DATA,
1433,213202423C,Brooklyn,3,13,313,BK 13,C, ,Educational programs,"Build or expand affordable work or research lab spaces related to key industries, such as film/tv, advanced manufacturing, life science and healthcare, renewable energy and freight maritime","We need to build an incubator/research lab spaces to entice small businesses to grow. We increasing rental space price and huge overhead cost to start a business, an incubator can address these issues.",,,,,,,EDC,802,8,Further study by the agency of this request is needed.,NO LOCATION DATA,
1411,213202412C,Brooklyn,3,13,313,BK 13,C, ,Healthy lifestyles programs,Install security cameras or make other safety upgrades,"Sufficient funds are requested for the installation of Secure Building Entrance Systems for all NYCHA housing developments including but not limited to security cameras (digital, high-resolution closed-circuit television cameras), televised intercom units, vandal-proof entrance doors, and any safety upgrades, etc. to provide enhanced security for tenants and additional monitoring capability for housing management and law enforcement.",,,,,,,NYCHA,996,3,"The agency recommends funding this expense budget request in FY 2024, but at this time the availability of funds is uncertain.",NO LOCATION DATA,
1405,213202409C,Brooklyn,3,13,313,BK 13,C, ,Programs to address other public health issues,Renovate or upgrade existing precinct houses,We need to renovate the 60th Precinct station and make it ADA compliance and expand the area. People cannot get to the second floor without an elevator and there isn't one available. Also there is need to expand the community meeting room on the second floor.,,,,,,,NYPD,56,2,The agency will try to accommodate this issue within existing resources.,NO LOCATION DATA,
1435,213202424C,Brooklyn,3,13,313,BK 13,C, ,Cultural facilities and resources,Other transportation infrastructure requests,We need a study to see if an on/off ramp can be constructed at Stillwell Avenue and Shore Parkway to alleviate traffic in the area.,,,,,,,DOT,841,6,The Borough Commissioner's office has reviewed this request.  This request has been denied. Please contact the B/C's office for further details.,NO LOCATION DATA,
1441,213202427C,Brooklyn,3,13,313,BK 13,C, ,Housing oversight and emergency programs,Repair or provide new street lights,"Brighton Beach Avenue is exceptionally wide, and the existing street lighting does not extend to adequately bathe pedestrians in light. This is especially true on the southside of Brighton Beach Avenue adjacent to the public park at the Oceana where the lush trees obscure the sidewalk and keep it in darkness. Pedestrian-level lighting in the form of (what are called by DOT) B-pole lights would greatly enhance visibility and remove the element of vulnerability which is currently the pedestrian experience.",,,,,,,DOT,841,7,More information is needed from the community board before making a funding decision. The community board should contact the agency.,NO LOCATION DATA,
1439,213202426C,Brooklyn,3,13,313,BK 13,C, ,Programs to address other public health issues,Other cultural facilities and resources requests,There is a lack of cultural facility for the area. We need to give the community choices other than sport facilities. We need a performing arts facility that will attract Southern Brooklyn people to the area.,,,,,,,DCLA,126,7,"More information is required, specifically each request must be tied to one organization, and mention a specific project.",NO LOCATION DATA,
1425,213202419C,Brooklyn,3,13,313,BK 13,C, ,Services for homebound older adults,Invest in infrastructure that will support growth in commercial business districts,"With the rise of smartphones and other portable electronic devices, we need to improve the availability speed and cost of broadcast access to local businesses and residents.",,,,,,,EDC,802,8,Further study by the agency of this request is needed.,NO LOCATION DATA,
1401,213202407C,Brooklyn,3,13,313,BK 13,C, ,Naturally Occurring Retirement Community (NORC) programs,Provide surveillance (Argus) cameras,"Sufficient funds are requested for surveillance cameras in chronic troubled locations to provide enhanced security to enable law enforcement efforts to better monitor high crime areas including but not limited to the Coney Island and Brighton Beach areas but also the amusement area including the Riegelmann Boardwalk, and other chronic high crime locations in the district.",,,,,,,NYPD,56,3,"Argus cameras are funded via allocations from elected officials for use within their districts.  Specific location recommendations should be provided to the local precinct commander for submission to the Information Technology Bureau once funding is allocated.  The NYPD will attempt to accommodate specific location requests whenever funding is provided, but reserves the right to place cameras as appropriate due to current crime trends and operational needs.",NO LOCATION DATA,
1481,214202406C,Brooklyn,3,14,314,BK 14,C, ,Street trees and forestry services,Repair or upgrade subway stations or other transit infrastructure,Church Avenue is the most heavily utilized station in the district and is in disrepair. Improving subway stations was the top transportation need in a CB14 survey. This line has had the most requests for security cameras.,Site Name: Church Ave Brighton Line Station;   Street Name: Church Ave and E 18 St,Church Ave Brighton Line Station,Church Ave and E 18 St,Church Ave E 18 St,,,NYCTA,998,7,"For information regarding the status of this Request, contact the Transit Authority directly at telephone number 646-252-2660.",GEOCODING FAILED,
1473,214202402C,Brooklyn,3,14,314,BK 14,C, ,"Park, buildings, and access improvements",Upgrade or create new plazas,We urge DOT to include Newkirk Plaza into the Plaza Program.  The infrastructure exists.  An organization is willing to partner and the Plaza should be under the auspices of a City agency given that it is public property.  Open space is one of the social determinants of public health and a well programmed Plaza would serve as an economic development boost to businesses on Newkirk Plaza.,,,,,,,DOT,841,10,Please contact the Borough Commissioner's office to discuss this request.,NO LOCATION DATA,
1475,214202403C,Brooklyn,3,14,314,BK 14,C, ,Traffic and traffic flow,Renovate or upgrade existing precinct houses,"The history of efforts to relocate this aging facility goes back three decades. In 2006, DCAS began property acquisition at 1326 Ocean Avenue and NYPD set aside $30 million for the property, and OMB stated its commitment to identify additional funding. Construction was set to begin in 2013.  It did not and the site was lost to a market rate housing development.  A scoping study to asses the feasibility of building a new precinct house on site acknowledges the locational challenges that the current site presents and OMB has just approved a new site search. Relocating the precinct house remains a priority. In the meantime, the current precinct house floods and leaks and does not have adequate lockers, storage, or parking, nor it is handicap accessible.",,,,,,,NYPD,56,3,"Additional NYPD resources for this project are unavailable at this time due to funding constraints. However, the program will continue to operate within current funding levels.",NO LOCATION DATA,
1477,214202404C,Brooklyn,3,14,314,BK 14,C, ,Street and lot cleaning,"Roadway maintenance (i.e. pothole repair, resurfacing, trench restoration, etc.)","Three years ago, DOT identified $60 million for trench repair but none of it was allocated to CD14, despite worsening conditions. There must be an increase in the expense budget for road and street infrastructure repair. Beverley Road Marlborough Rd Marlborough Rd. DOT had a $60 million allocation for trench restoration and CB 14 received none of it. Six locations have been submitted to DOT. 564 East 29th Street; 1781 Ocean Avenue/SE corner of Avenue M; 715 Ocean Parkway Service Road; Waldorf Court between East 17 and Dead End; Hillel Place and Kenilworth Place intersection; 464-476 East 16th Street. A seventh location has occurred on East 16th Street between Avenue H and the dead end.  The CB14 office is on this block so we will be sure to keep an eye on it.",,,,,,,DOT,841,3,Funding constraints preclude the hiring of additional personnel at this time.,NO LOCATION DATA,
1483,214202407C,Brooklyn,3,14,314,BK 14,C, ,Consumer and worker protection,Inspect water main on specific street segment and repair or replace as needed,"There are several locations in the District that flood chronically in rainstorms. These locations have all been brought to DEP's attention and we are awaiting determination as to cause.  DCP has provided a limited drop down list from which to choose a budget priority.  We ask the DEP respond to the requests pending and advise as to what the respective issues are so that we can identify what budget line these requests fall into.  The bottom line is that DEP must provide solutions to these locations because property, businesses and public areas should not have to withstand chronic flooding.  What capital projects would help in these various locations: bioswales, catch basins, permeable surface additions, holding tanks?",,,,,,,DEP,826,8,Further study by the agency of this request is needed.,NO LOCATION DATA,
1491,214202411C,Brooklyn,3,14,314,BK 14,C, ,Schools and educational facilities,Rehabilitate or renovate existing fire houses or EMS stations,Fund station house renovations and upgrades at Engine 255/Ladder 157; Engine 281/Ladder 147 and Engine 250 firehouses.  Including the addition of a station house generator at one of these fire stations.  There are no firehouses in CD 14 with a generator.,,,,,,,FDNY,57,8,"Emergency generators are being installed throughout firehouses on a yearly basis, priority established by Fire Operations, funding is reliant on Federal Grants. Repairs and upgrades to facilities must be scheduled carefully so overall (and local/neighborhood) emergency response operations are not negatively impacted. Additionally, these requests must be prioritized so more critical issues (e.g., health and safety or operational response issues) are addressed first. We repair all facilities as resources and priorities allow.",NO LOCATION DATA,
1493,214202412C,Brooklyn,3,14,314,BK 14,C, ,FDNY facilities and equipment,"Create a new, or renovate or upgrade an existing public library (BPL)","The following capital improvements are needed at our local libraries:  Cortelyou Branch - safety and security enhancements; Flatbush Branch - safety and security enhancements, and abatement; Midwood Branch - safety and security enhancements, boiler, HVAC, roof.",,,,,,,BPL,38,2,Partial funding for this request already exists.  The BPL requests new funding for the additional components. Contact the BPL for additional information.,NO LOCATION DATA,
1518,214202414C,Brooklyn,3,14,314,BK 14,C, ,FDNY programs and staffing,Add NYPD parking facilities,"Increasingly we are told that large tow vehicles are not available, or that there is no space in the tow lot.  This has created a backlog and long waits for the removal of illegally parked vehicles and an ongoing issue with overnight commercial parking of tractor trailers on both commercial or residential streets.  An increased investment in both tow equipment and tow lots is needed.",,,,,,,NYPD,56,3,The NYPD is working with the Mayor's Office of Management and Budget in order to secure additional towing facilities.,NO LOCATION DATA,
1520,214202415C,Brooklyn,3,14,314,BK 14,C, ,Homelessness prevention programs,Provide new or upgrade existing sanitation garages or other sanitation infrastructure,We are gratified that the condemned heating and cooling systems installed on the BK14 roof will be upgraded in the upcoming fiscal year so that the garage has heat in the winter and adequate cooling in the summer.,,,,,,,DSNY,827,1,"This project was funded in a prior fiscal year, the final design work has started",NO LOCATION DATA,
1552,215202411C,Brooklyn,3,15,315,BK 15,C, ,Services for the homeless,"Provide a new, or new expansion to, a building in a park","Brigham Park, a newly constructed park located on Emmons Avenue and Brigham Street, does not have adequate funding to provide a comfort station. Given its remote location, for the seniors and children of our community, the inclusion of a comfort station would be a necessity.",Cross Street 1: Emmons Avenue  Cross Street 2: Emmons Avenue,,,,Emmons Avenue,Emmons Avenue,DPR,846,5,This project has not been funded.,GEOCODING FAILED,
1562,215202416C,Brooklyn,3,15,315,BK 15,C, ,NYPD programs,Other capital budget request for DEP,The Coney Island Water Treatment Plant located at 3002 Knapp Street is in need of an increase in overall plant budget for on-going maintenance of the water treatment plant. We need funding for force main repair and additional funding for odor control equipment for repairs and improvements.,Site Name: Coney Isld Water Treatment Plant;   Street Name: 3002 Knapp Street,Coney Isld Water Treatment Plant,3002 Knapp Street,Knapp Street,,,DEP,826,5,This project is included in the ten-year plan.,GEOCODING FAILED,
1572,215202421C,Brooklyn,3,15,315,BK 15,C,street,Sanitation Enforcement,"Other requests for park, building, or access improvements","We need funding the replace the sidewalk adjacent to Holocaust Park on the Sheepshead Bay side. The sidewalk is broken up, a trip hazard and appears to be sinking in certain spots. Our main concern is that it's over water so we need to locate the source of the sidewalk failure and correct and restore it as soon as possible.",Site Name: Holocaust Park;   Street Name: West End Avenue,Holocaust Park,West End Avenue,West End Avenue,,,DPR,846,5,This project has not been funded.,GEOCODING FAILED,
1580,215202425C,Brooklyn,3,15,315,BK 15,C, ,Garbage collection and recycling,"Other requests for park, building, or access improvements","Pritchard Mall Green Space located on Corbin Place (between Brighton Beach Avenue and Oriental Boulevard) has become a broken up, hazardous looking eyesore. Crumbling cement surrounds the entire area and needs to be restored.All the dead brown hedges need to be replaced. It could be repurposed as a sitting area.",Site Name: Pritchard Mall Green Space;   Street Name: Corbin Place btw BBA & Ortl Blvd,Pritchard Mall Green Space,Corbin Place btw BBA & Ortl Blvd,Ortl Blvd,,,DPR,846,8,Further study by the agency of this request is needed.,GEOCODING FAILED,
1591,215202432C,Brooklyn,3,15,315,BK 15,C,street,Transportation infrastructure,"Create a new, or renovate or upgrade an existing public library (BPL)","$11,350,000 is needed to upgrade and enhance the Sheepshead Bay Library Branch. The breakdown is as follows: $2 million - Acquistion currently leased. $1 million ADA compliance for entire branch $200, 000 for safety and security enhancements $750,000 exterior work $400.000 Site Drainage $3 million for interior renovation 1 million for outfitting ff&e 2 million for heating and cooling 1 million for roof",Site Name: Sheephead Bay Library,Sheephead Bay Library,,,,,BPL,38,3,"BPL supports this project as requested by the community board.  However, City funded financial support is necessary to undertake this project.",GEOCODING FAILED,
1603,215202438C,Brooklyn,3,15,315,BK 15,C, ,Affordable housing programs,Other capital budget request,"In our community is an old historic guard house at the foot of the Ocean Avenue bridge. It was used by the police to guard over Manhattan Beach half a century ago and is the last remaining one in the district. The community would like to see it restored, preserved and maintained if only for its historical significance.",Site Name: Shore Boulevard -Guard House,Shore Boulevard -Guard House,,,,,DOB,810,10,This request is not recommended for funding.,GEOCODING FAILED,
1599,215202436C,Brooklyn,3,15,315,BK 15,C, ,Workforce development,"Other requests for park, building, or access improvements","Shore Boulevard Promenade is in need of a make-over. It needs repaving, new benches, landscaping and new refuse/garbage cans.",Site Name: Shore Boulevard Promenade,Shore Boulevard Promenade,,,,,DPR,846,5,This project has not been funded.,GEOCODING FAILED,
1495,215202426C,Brooklyn,3,15,315,BK 15,C, ,"Library facilities, equipment and programs (BPL)",Repair or construct new curbs or pedestrian ramps,"New curbs and sidewalks are requested for Kings Highways between Mcdonald Avenue and Ocean Parkway. Currently, these sidewalks contain numerous defects rendering them unsafe for pedestrians and subjecting the city to trip and fall lawsuits.",Street Name: Kings Highway    Cross Street 1: Mcdonald Avenue  Cross Street 2: Ocean Parkway,,Kings Highway,Kings Highway,Mcdonald Avenue,Ocean Parkway,DOT,841,8,Further study by the agency of this request is needed.,GEOCODING FAILED,
1497,215202427C,Brooklyn,3,15,315,BK 15,C, ,NYPD facilities and equipment,Repair or provide new street lights,Sufficient funds are requested to upgrade the existing streetlights for improved lighting in response to increases in car break-ins and robberies in the area.,Street Name: Oriental Boulevard    Cross Street 1: Corbin Drive  Cross Street 2: Pembroke Street,,Oriental Boulevard,Oriental Boulevard,Corbin Drive,Pembroke Street,DOT,841,8,Further study by the agency of this request is needed.,GEOCODING FAILED,
1607,215202440C,Brooklyn,3,15,315,BK 15,C, ,After school programs,Provide new or upgrade existing sanitation garages or other sanitation infrastructure,Brooklyn Community Board 15's Sanitation garage is a temporary structure of trailers located on Knapp Street. We are requesting a permanent home for our Sanitation garage and encourage more aggressive siting actions by the department.,,,,,,,DSNY,827,5,"Although the Department of Sanitation supports this program, due to fiscal constraints the availability of funds is uncertain.",NO LOCATION DATA,
1587,215202430C,Brooklyn,3,15,315,BK 15,C, ,Other budget request,Other transit infrastructure requests,Sufficient funds are requested for the upgrading and installation of wrought-iron fencing along the transit berms and properties adjacent to the B/Q subway lines including properties (1) across from 2750 Homecrest Avenue to 2735 E 13th Street; and (2) along East 15th Street between Avenue Z and Avenue Y.,,,,,,,NYCTA,998,7,More information is needed from the community board before making a funding decision. The community board should contact the agency.,NO LOCATION DATA,
1540,215202405C,Brooklyn,3,15,315,BK 15,C,street,Street and lot cleaning,Other NYPD facilities and equipment requests,"Currently, Brooklyn does not have the capability to regularly tow heavy vehicles such as a semi-truck or a bus. Instead we have to rely on a special tow truck to be dispatched from Manhattan periodically. Brooklyn must have its own designated heavy load tow truck.",,,,,,,NYPD,56,1,The Brooklyn Tow Pound is now equipped with a heavy duty tow truck.,NO LOCATION DATA,
1538,215202404C,Brooklyn,3,15,315,BK 15,C, ,Animal and pest control services,Add NYPD parking facilities,"Currently, Brooklyn has only one police Tow Pound in Northern Brooklyn and it's often at full capacity. This is a growing problem for our community. Additional car lifts (stackers) at the existing Tow Pound would increase holding capacity and permit more vehicles to be stored as an immediate interim measure. The current pound being located across the borough results in long travel times. It limits the turnaround time resulting in diminished productivity per work shift for Row Tow operators serving Southern Brooklyn. Ideally, we would like the short-term addition of car lifts at the existing Tow Pound until a new pound can be sited and constructed in Southern Brooklyn to expedite Row Tow operations enhancing their capacity and increasing their productivity.",,,,,,,NYPD,56,3,The NYPD is working with the Mayor's Office of Management and Budget in order to secure additional towing facilities.,NO LOCATION DATA,
1532,215202401C,Brooklyn,3,15,315,BK 15,C, ,FDNY programs and staffing,Provide more housing for medium income households,"Our seniors can no longer afford to maintain their properties and stay in their homes. Rentals are too expensive on fixed incomes. With an increasing aging population we need to create affordable senior communities. New York City is way behind in that area. Our middle class numbers have decreased. Real estate prices have sky-rocketed in our community. It is becoming impossible for people who grew up here or raised a family here to remain in our community. Home ownership is now a pipe dream, only affordable for the very wealthy. Rents are becoming so high that families have taken up residence in illegally created apartments, sometimes overcrowded to the point of being unsafe.",,,,,,,HPD,806,2,This request includes more than one proposal.  Funding for part is recommended.,NO LOCATION DATA,
1574,215202422C,Brooklyn,3,15,315,BK 15,C,street,Street and lot cleaning,Repair or provide new street lights,We would like to see the addition of solar-powered street lights and traffic signals throughout our community district as a resiliency measure in the event of future storm-related outages.,,,,,,,DOT,841,7,More information is needed from the community board before making a funding decision. The community board should contact the agency.,NO LOCATION DATA,
1627,216202411C,Brooklyn,3,16,316,BK 16,C, ,Schools and educational facilities,"Improve accessibility of transit infrastructure, by providing elevators, escalators, etc.",The Broadway Junction station has a very high volume of pedestrian traffic because of its connection to 3 train lines and 5 bus lines. The station has a series of stairs that prevent the physically challenged from using this facility. We are requesting that the station be made handicap accessible.,Site Name: Broadway Junction station,Broadway Junction station,,,,,NYCTA,998,7,"For information regarding the status of this Request, contact the Transit Authority directly at telephone number 646-252-2660.",GEOCODING FAILED,
1669,216202440C,Brooklyn,3,16,316,BK 16,C, ,FDNY facilities and equipment,"Improve accessibility of transit infrastructure, by providing elevators, escalators, etc.","The Junius Street station on the IRT line is an elevated structure and is not handicap accessible. An elevator or escalator is needed to enable persons who cannot walk up the stairway to use the station. We're also requesting the construction of a passageway between the ""Junius Street"" station on the IRT-3 and the ""Livonia Avenue"" station on the IND-L to enable commuters to transfer between stations without descending to the street to re-enter the transit system.",Site Name: Junius St station,Junius St station,,,,,NYCTA,998,7,"For information regarding the status of this Request, contact the Transit Authority directly at telephone number 646-252-2660.",GEOCODING FAILED,
1653,216202424C,Brooklyn,3,16,316,BK 16,C, ,Transit Infrastructure,"Improve accessibility of transit infrastructure, by providing elevators, escalators, etc.","The New Lots Avenue station on the ""L"" line is an elevated structure and is not handicap accessible. An elevator or escalator is needed to enable persons who cannot walk up the stairway to use the station",Site Name: New Lots Ave station,New Lots Ave station,,,,,NYCTA,998,7,"For information regarding the status of this Request, contact the Transit Authority directly at telephone number 646-252-2660.",GEOCODING FAILED,
1626,216202409C,Brooklyn,3,16,316,BK 16,C, ,Schools and educational facilities,"Improve accessibility of transit infrastructure, by providing elevators, escalators, etc.",The Rockaway Avenue station on the IRT line is an elevated structure and is not handicap accessible. An elevator or escalator is needed to enable persons who cannot walk up the stairway to use the station.,Site Name: Rockaway Ave station,Rockaway Ave station,,,,,NYCTA,998,7,More information is needed from the community board before making a funding decision. The community board should contact the agency.,GEOCODING FAILED,
1654,216202425C,Brooklyn,3,16,316,BK 16,C,street,Transportation infrastructure,"Improve accessibility of transit infrastructure, by providing elevators, escalators, etc.",The Saratoga Avenue station on the IRT line is an elevated structure and is not handicap accessible. An elevator or escalator is needed to enable persons who cannot walk up the stairway to use the station.,Site Name: Saratoga Ave station,Saratoga Ave station,,,,,NYCTA,998,7,More information is needed from the community board before making a funding decision. The community board should contact the agency.,GEOCODING FAILED,
