unique_id,tracking_code,borough,borough_code,cd,commdist,cb_label,type_br,type,priority,need,request,explanation,location,site_name,address,street_name,street_cross_1,street_cross_2,supporters_1,supporters_2,parent_tracking_code,agency_acronym,agency,agency_category_response,agency_response,geo_function,geom
3115,405202429C,Queens,4,05,405,QN 05,C, ,29,After school programs,Renovate or upgrade existing precinct houses,"REHABILITATE THE 104TH POLICE PRECINCT INTERIOR AND EXTERIOR  The 104th Police Precinct station house is an old building and ongoing improvements needed include: heating system upgrades, plumbing upgrades (including: waste lines, supervisor's bathroom on the 1st floor, 2nd floor male bathroom and prisoner bathroom),electrical upgrades, windows replacement, providing handicapped access, fixing basement leaks, central air conditioning, and refurbishing the main desk.",Site Name: 104 Police Precinct;   Street Name: 64-02 Catalpa Avenue,104 Police Precinct,64-02 Catalpa Avenue,Catalpa Avenue,,,Ridgewood Property Owners Civic Association,Glendale Property Owners Association,,NYPD,56,3,"Over the course of several years, the NYPD has made several large-scale improvements to the command, making it a viable facility for the foreseeable future. Funding constraints preclude the advancement of the project at this time.",geosupport_1B_address,0104000020E61000000100000001010000003487A2E7307952C07AD9357F255A4440
2989,403202439C,Queens,4,03,403,QN 03,C,site,CS,"Park, buildings, and access improvements",Reconstruct or upgrade a building in a park,Continued Support - Restore the Queens Green House at Forest Park.,Site Name: Forest Park Greenhouse,Forest Park Greenhouse,,,,,,,,DPR,846,5,Parks Department funds are insufficient for this purpose. We recommend this request be brought to the attention of your Council Members.,geosupport_1B_place,0104000020E610000001000000010100000073BB6EAFD47652C0F428A820C6594440
3397,410202420C,Queens,4,10,410,QN 10,C, ,20,FDNY facilities and equipment,"Other requests for park, building, or access improvements",Support Forest Park Greenhouse and contract staffing.  Plants grown in this facility support Parks and public spaces in Community Board 10.,Site Name: Forest Park Greenhouse,Forest Park Greenhouse,,,,,Area Residents,Civic Associations,,DPR,846,5,Parks Department funds are insufficient for this purpose. We recommend this request be brought to the attention of your Council Members.,geosupport_1B_place,0104000020E610000001000000010100000073BB6EAFD47652C0F428A820C6594440
3207,407202419C,Queens,4,07,407,QN 07,C,site,19,NYPD facilities and equipment,Renovate or upgrade an existing cultural facility,"Upgrade a cultural facility-Poppenhusen Institute in College Point Increase funding for the Institute in College Point to preserve its historic structure.  Need to complete a partially funded  Bluestone Sidewalks & Exterior lamp posts needed is $1,183,000.The building has sustained damage and needs the installation of electric etc.,a gas lighting system, safety upgrades for a second means of egress to include raised handrails.  This Landmark facility should be funded by the city and not individual organizations as Poppenhusen falls under the Department of Cultural Affairs. for Qns. County. Board 7 supports funding for this request (2000)",Site Name: Poppenhusen Institute;   Street Name: 114-04 14th Road College Point 11356,Poppenhusen Institute,114-04 14th Road College Point 11356,14th Road,,,,,,DCLA,126,3,"This project was funded in a prior fiscal year, but the scope is currently not fully funded. The Department of Cultural Affairs recommends this project be brought to the attention of your local elected official, i.e. Borough President or City Council member, to request additional funding.",geosupport_1B_address,0104000020E610000001000000010100000048898E0D967652C0437F8AC666644440
3215,407202423C,Queens,4,07,407,QN 07,C, ,23,"Park, buildings, and access improvements",Other NYPD facilities and equipment requests,"Renovation of 109th Pct. to replace or repair Precinct driveway due to continued vehicle traffic from patrol vehicle scooters, rack trucks & heavy ESU rescue apparatus. Supervisors & Male locker rooms to be upgraded. At present locker rooms are old and must be updated. Female locker rooms are updated.Plumbing (hot water system needs upgrading or replaced due to increased personnel for a Super Precinct. Board 7 continue support 10/5/22 called & e-mailed NYPD not had a response.as yet.",Site Name: 109th Pct.,109th Pct.,,,,,109th Pct. Community Council,,,NYPD,56,5,The NYPD is working with the Mayor's Office of Management and Budget (OMB) to secure capital funds for facility improvements.,geosupport_1B_place,0104000020E6100000010000000101000000D6770EE0ED7452C02988C87894614440
3186,407202408E,Queens,4,07,407,QN 07,E,site,08,"Park, buildings, and access improvements",Hire additional uniformed officers,"Allocate additional personnel  for the 109th Precinct to address quality of life complaints, noise, illegal truck traffic/parking due to fiscal constraints, the availability of funds is uncertain.  Due to heavy retirements in this Agency additional personnel is needed. CB7 is a Super District & personnel is needed to accommodate the Precinct's  large administrative boundaries ESPECIALLY SINCE THE 109 PCT. IS THE HIGHEST IN CRIME IN THE CITY. Maintain the DARE program (workshop on drug education for school children).  Plus civilian personnel to relieve officers assigned to the 109th precinct, school crossing guards.   In addition, the K9 unit dogs at Fort Totten are capable of sniffing out drugs and bombs.(2002)",Site Name: 109th Precinct,109th Precinct,,,,,,,,NYPD,56,5,NYPD total staffing levels depend on decisions made in the Preliminary and Executive budget process.  Allocation of uniformed personnel is scheduled by the NYPD only after graduation of Police classes from the Academy. Availability of civilian personnel is limited due to reductions to the civilian headcount.,geosupport_1B_place,0104000020E6100000010000000101000000D6770EE0ED7452C02988C87894614440
3199,407202415C,Queens,4,07,407,QN 07,C,site,15,FDNY programs and staffing,Reconstruct or upgrade a building in a park,"Reconstruct or renovate the Willets Family Farm House in Fort Totten.An architectural & structural assessment needs to be done in order to stabilize the building, salvage the remaining details that dated to its original 1829 construction.  The Willets Farm House will continue to be an important.  contributing resource in the Fort Totten Historic District & testament to the early development of the borough.OMB supports this project but Parks Dept. funding insufficient recommended contacting Elected Officials & Boro Hall Board 7 continue funding support for this  request. (2017)",Site Name: Fort Totten,Fort Totten,,,,,Bay Terrace Community Alliance,Bayside Historical Society,,DPR,846,5,Parks Department funds are insufficient for this purpose. We recommend this request be brought to the attention of your Council Members.,geosupport_1B_place,0104000020E61000000100000001010000008274BA967E7152C06DBD78D20C654440
3208,407202419E,Queens,4,07,407,QN 07,E, ,19,Housing oversight and emergency programs,Expand funding for fire prevention and life safety initiatives,"Fire Marshals are the detectives for the Fire Department and on scene of a fire to determine if arson is the cause. The evidence must not be destroyed, and with the projected opening of the base in Queens the backload of open cases and arson fires will be reduced. Request funding for Fire Marshal Personnel and programs ie. the Juvenile Fire Setters Intervention and the arson task force. OMB says further study is required.  FDNY recently graduated a class of 28 Marshals on 8/6 another expected to go in before the end of the year.  Youth Fire Setters intervention Program conducted 135 interventions this year; Auto Fraud Squad investigates all motor vehicle fires and a new Task Force was formed to investigate fires involving Lithium-Ion batteries.  CB7 Continues to support funding. (2005)",Site Name: Fire Marshal Base at Fort Totten,Fire Marshal Base at Fort Totten,,,,,,,,FDNY,57,8,Further study by the agency of this request is needed.,geosupport_1B_place,0104000020E61000000100000001010000008274BA967E7152C06DBD78D20C654440
3228,407202434C,Queens,4,07,407,QN 07,C,general,CS,Sewage and flooding,Other FDNY facilities and equipment requests,"There is a need to develop a multi agency civic learning center to teach youngsters about safety issues as it pertains to fire, buildings, environmental protection, health, police and sanitation departments.  In addition, these site could be used for seniors as a refresher center.",Site Name: Fort Totten,Fort Totten,,,,,Bay Terrace Community Alliance,,,FDNY,57,8,Further study by the agency of this request is needed.,geosupport_1B_place,0104000020E61000000100000001010000008274BA967E7152C06DBD78D20C654440
3249,408202411C,Queens,4,08,408,QN 08,C,site,11,Schools and educational facilities,Provide a new or expand an existing elementary school,"Upgrade the sound system for the auditorium of P.S. 26. Upgrade the electrical wiring for P.S.26Q for the installation of air conditioning in the auditorium, gymnasium and cafeteria. The school is used in the summer to house the P.S. 224 students who are developmentally disabled. They require temperature controlled environments as per the mandate for ADA compliance.",Site Name: P.S. 26,P.S. 26,,,,,Fresh Meadows Homeowners' Civic Association,,,DOE,40,6,Unable to prioritize funding for this project request at this time.,geosupport_1B_place,0104000020E610000001000000010100000071BC3F04C97152C05FF9C307475E4440
3274,408202427C,Queens,4,08,408,QN 08,C,site,27,Schools and educational facilities,"Create a new, or renovate or upgrade an existing public library (QL)",Provide funds for the Hillcrest Library 's interior and exterior renovations. Partly funded by former Councilman Rory Lancman more funds are needed.,Site Name: QBPL - Hillcrest Branch;   Street Name: 187-05 Union Turnpike,QBPL - Hillcrest Branch,187-05 Union Turnpike,Union Turnpike,,,Hillcrest Estates Civic Association,,,QPL,39,3,QBPL recommends funding this capital budget item in FY 2024 but at this time the availability of funds is uncertain.,geosupport_1B_address,0104000020E610000001000000010100000075816ABC0A7252C0DB379F28585D4440
3423,411202404E,Queens,4,11,411,QN 11,E,general,04,Street trees and forestry services,Increase case management capacity,"Additional funding is needed to reduce social worker caseloads currently about 65 cases per worker. Reductions in caseload will improve service delivery to the elderly. SNAP serves Community Boards 8, 11, and 13.",Site Name: Services Now for Adult Persons;   Street Name: 80-45 Winchester Blvd,Services Now for Adult Persons,80-45 Winchester Blvd,Winchester Blvd,,,,,,DFTA,125,5,Approval of this request depends on sufficient Federal/State funds.,geosupport_1B_address,0104000020E61000000100000001010000002607CD84A76E52C05F36551D585E4440
3334,409202409C,Queens,4,09,409,QN 09,C,general,09,Senior center programs,Renovate interior building component,Richmond Hill High School requests the construction of a Greenhouse on school property (outside) and Hydroponics Classroom. Students will be able to develop an idea of sustainability  Students will be offered the opportunity to engage in hands on learning/Project based learning  Students will gain an alternative opportunity to engage in NY Regents approved labs Real World Application of Standards based instruction,"Site Name: Richmond Hill High School;   Street Name: 89-30 114th St, Queens, NY 11418",Richmond Hill High School,"89-30 114th St, Queens, NY 11418",114th St,,,,,,DOE,40,6,This request is not recommended for funding.,geosupport_1B_address,0104000020E6100000010000000101000000D7A7FFC35B7552C0695B3199F3584440
3343,409202415C,Queens,4,09,409,QN 09,C,site,15,Street trees and forestry services,Renovate or upgrade existing precinct houses,The parking lot adjacent to the 102nd Precinct building needs to be resurfaced and repair. This will provide adequate parking for police office and free up street parking in front of residential property,"Site Name: 102 Precinct;   Street Name: 87 118 Street, Queens, New York, NY",102 Precinct,"87 118 Street, Queens, New York, NY",118 Street,,,,,,NYPD,56,8,Further study by the agency of this request is needed.,geosupport_1B_place,0104000020E61000000100000001010000006605F772387552C006FBCA626F594440
3391,410202417C,Queens,4,10,410,QN 10,C,street,17,Transportation infrastructure,Renovate or upgrade existing precinct houses,Build 106th Precinct Parking lot. Lack of parking space in the perimeter of the 106th Precinct arouses residents' ire and blocks trucks and other larger vehicles like fire engines from readily navigating the streets near the Precinct. The precinct block abuts Liberty Ave. which is a congested corridor. Lack of off street parking exacerbates congestion.,Site Name: 106th Precinct,106th Precinct,,,,,Ozone Park Civic,106th Precinct,,NYPD,56,5,"NYPD's funding constraints, project capacity and Department priorities rule out including this project at this time.",geosupport_1B_place,0104000020E610000001000000010100000039708274BE7552C06FA0934852574440
3406,410202426C,Queens,4,10,410,QN 10,C,street,26,Transportation infrastructure,Renovate or upgrade existing precinct houses,Agency request to support Capital improvements at the Precinct level.   Many of the Police Department's facilities are old buildings that need upgrades regularly. We request facility upgrades at the 106 Pct.,Site Name: 106 Precinct,106 Precinct,,,,,Area residents,,,NYPD,56,2,This request includes more than one proposal.  Funding for part is recommended.,geosupport_1B_place,0104000020E610000001000000010100000039708274BE7552C06FA0934852574440
3477,412202407E,Queens,4,12,412,QN 12,E, ,07,Park maintenance and safety,Other expense budget request for DPR,"Fund King Manor museum in Jamaica.  The King Manor Association manages the recently restored home of Founding Father, Rufus king. Mr. King's legacy includes important work as a delegate to the Constitutional Convention, and Contributions as a skilled diploma, statesman and an outspoken opponent of Slavery. This Historic site of national significance with exceptional educational potential. Children, adults and Families are participating in the educational programs in steadily increasing numbers. In the past 12 months there has been a 200 percent increase in school programs and the Manor has served four times as many students and teachers as previously.",Site Name: King Manor Museum;   Street Name: 150-03 Jamaica Ave,King Manor Museum,150-03 Jamaica Ave,Jamaica Ave,,,King Manor Museum,,,DPR,846,3,"The agency recommends funding this expense budget request in FY 2024, but at this time the availability of funds is uncertain.",geosupport_1B_address,0104000020E610000001000000010100000091B0D6DE707352C0D565DBA1FE594440
3250,408202413C,Queens,4,08,408,QN 08,C, ,13,Naturally Occurring Retirement Community (NORC) programs,Provide a new or expand an existing middle/intermediate school,"Construct a design classroom for woodworking and engineering classes at JHS 217, as per the design at Thomas Edison H.S.","Site Name: JHS 217;   Street Name: 85-05 144 Street, Queens, New York, NY",JHS 217,"85-05 144 Street, Queens, New York, NY",144 Street,,,,,,DOE,40,3,The agency will try to accommodate this issue within existing resources.,geosupport_1B_address,0104000020E61000000100000001010000002CA1CBDFF47352C02FEDA5C1EE5A4440
3603,501202402C,SI,5,01,501,SI 01,C, ,02,FDNY facilities and equipment,"Provide a new NYPD facility, such as a new precinct house or sub-precinct","Provide a new NYPD facility, such as a new precinct house or sub-precinct - With the proposed Bay Street Corridor Affordable Housing rezoning, coupled with the new North Shore residential and commercial redevelopment, the current 120th is no longer adequate for the personnel and equipment nd vehicles needed to keep the public safe. The proposed Hill Street stationhouse needs to be built.",Site Name: 120 Precinct,120 Precinct,,,,,,,,NYPD,56,3,"Additional NYPD resources for this project are unavailable at this time due to funding constraints. However, the program will continue to operate within current funding levels.",geosupport_1B_place,0104000020E61000000100000001010000007EF988FAF48452C0D838AC8C83524440
3677,502202410C,SI,5,02,502,SI 02,C, ,CS,Garbage collection and recycling,Renovate or upgrade a senior center,Allocate funding in the budget to rehabilitate the vacant buildings on the campus of Sea View Hospital Rehabilitation Center and Home. There  are approximately 40 buildings and less than half are currently being used.,Site Name: Sea View Hospital Rehabilitation and Home;   Street Name: 460 Brielle Avenue,Sea View Hospital Rehabilitation and Home,460 Brielle Avenue,Brielle Avenue,,,,,,DFTA,125,10,This is not in the City's budget jurisdiction.  Contact OMB's Community Board Unit.,geosupport_1B_address,0104000020E61000000100000001010000005F655099978852C093AB5CFCCA4B4440
3679,502202411C,SI,5,02,502,SI 02,C, ,CS,Garbage collection and recycling,Renovate or upgrade an elementary school,"Install central air-conditioning units in PS 54.  As early as late spring into early summer, classroom temperatures rise as high as in the upper 90's. This is unacceptable working conditions for students,as well as teachers.","Site Name: PS 54 Charles W. Leng;   Street Name: 1060 Willowbrook Road, Staten Island",PS 54 Charles W. Leng,"1060 Willowbrook Road, Staten Island",Willowbrook Road,,,,,,DOE,40,6,Unable to prioritize funding for this project request at this time.,geosupport_1B_address,0104000020E610000001000000010100000014C09867D08852C0A3077D352A4D4440
3665,502202404C,SI,5,02,502,SI 02,C, ,04,Traffic and traffic flow,"Reconstruct or upgrade a park or amenity (i.e. playground, outdoor athletic field)","Renovate Willowbrook Park with new apparatus such as ramped play equipment, universally acceptable swings, and charcoal barbecue grills.  Willowbrook Park's Carousel, picnic grounds, and ballfield attract many families and an upgrade would enhance one of Staten Island's most popular Greenbelt parks.",Site Name: Willowbrook Park;   Street Name: 1 Eton Place,Willowbrook Park,1 Eton Place,Eton Place,,,,,,DPR,846,3,This request includes more than one proposal.  Funding for part is recommended.,geosupport_1B_address,0104000020E61000000100000001010000000A399DA1268A52C003BA6E09554D4440
3716,503202420C,SI,5,03,503,SI 03,C,site,CS,"Park, buildings, and access improvements",Provide new facilities such as a firehouse or EMS station,We request that NYC designate space for a FDNY satellite training facility to support ongoing training for EMTs and paramedics. NYC recently acquired a 7 acre property (former St. John Villa Academy) in Staten Island earmarked for the Department of Education. In addition to being used as a training facility it would serve the Staten Island community as classroom space for community residents to take the Free FDNY CPR training courses.,"Site Name: former St. John Villa Academy;   Street Name: 57 Cleveland Place, Staten Island, New York, NY",former St. John Villa Academy,"57 Cleveland Place, Staten Island, New York, NY",Cleveland Place,,,,,,FDNY,57,8,Further study by the agency of this request is needed.,geosupport_1B_address,0104000020E6100000010000000101000000BC82CAEF5A8452C093CFFC89014D4440
259,105202441C,Bronx,2,05,205,BX 05,C, ,41,Environmental protection,Repair or provide new street lights,Burnside Avenue is a primary commercial and pedestrian corridor for our community.  Adequate street lighting is vital for both safety and business concerns.,Street Name: Burnside Avenue    Cross Street 1: Walton Avenue  Cross Street 2: Walton Avenue,,Burnside Avenue,Burnside Avenue,Walton Avenue,Walton Avenue,,,,DOT,841,8,Please contact the Borough Commissioner's office to discuss this request.,geosupport_2_street_name,0104000020E6100000010000000101000000F2925B45037A52C052D0B6A43E6D4440
765,202202435C,Brooklyn,3,02,302,BK 02,C, ,35,Youth workforce development,"Provide a new or expanded park or amenity (i.e. playground, outdoor athletic field)",Construction of a dog park in/near Commodore Barry Park. There are insufficient dog parks in this area which leads to dogs being exercised and relieved in park playgrounds and artificial turf.,"Site Name: Commodore Barry Park;   Street Name: 65 Park Ave, Brooklyn, NY 11201",Commodore Barry Park,"65 Park Ave, Brooklyn, NY 11201",Park Ave,,,,,,DPR,846,6,Not included in the master plan.,geosupport_1B_address,0104000020E6100000010000000101000000C5AEEDED967E52C003CC7C073F594440
843,204202404C,Brooklyn,3,04,304,BK 04,C,site,04,"Library facilities, equipment and programs (BPL)",Reconstruct or upgrade a building in a park,"The comfort station at Maria Hernandez Park is in serious need of an upgrade. There are frequent complaints about the lack of regular maintenance, pooling, and broken restroom equipment from community members, especially during the summertime. Given the high volume of visitors and recreational opportunities in general, a renovated comfort station is needed to better accommodate the public.",Site Name: Maria Hernandez Park,Maria Hernandez Park,,,,,,,,DPR,846,5,This project has not been funded.,geosupport_1B_place,0104000020E6100000010000000101000000E97C7896207B52C0D0471971015A4440
1278,210202426C,Brooklyn,3,10,310,BK 10,C, ,26,Street trees and forestry services,Reconstruct or upgrade a building in a park,"Complete Refurbishment of comfort station at Millenium Playground in Leif Ericson Park ? 5th Avenue at 66th Street ?including new plumbing fixtures, lighting, tile, and baby changing station",Site Name: Leif Ericson Park;   Street Name: 5 Avenue at 66 Street,Leif Ericson Park,5 Avenue at 66 Street,Avenue at 66 Street,,,,,,DPR,846,5,This project has not been funded.,geosupport_1B_place,0104000020E6100000010000000101000000276BD443348152C08693347F4C514440
1149,209202413C,Brooklyn,3,09,309,BK 09,C,street,13,Traffic and traffic flow,Other garbage collection and recycling infrastructure requests,Increase litter baskets and/ or replace the wire trash receptacles with Paris Site Furnishing (Model: NYC PSR Style-44G) trash receptacles.,Street Name: Rogers Avenue    Cross Street 1: Empire Boulevard  Cross Street 2: Empire Boulevard,,Rogers Avenue,Rogers Avenue,Empire Boulevard,Empire Boulevard,,,,DSNY,827,10,"High-end litter baskets are sponsored by local elected officials, businesses, community groups, etc.",geosupport_2_street_name,0104000020E6100000010000000101000000D01FE2D80B7D52C0D9CF390FF5544440
2100,304202443C,Manhattan,1,04,104,MN 04,C, ,CS,Sewage and flooding,"Provide a new or expanded park or amenity (i.e. playground, outdoor athletic field)",Continue to complete the design for a new park at West 48th Street and 10th Avenue as committed to during Western Rail Yard rezoning and negotiations.,Street Name: 10th Ave    Cross Street 1: West 48th St  Cross Street 2: West 48th St,,10th Ave,10th Ave,West 48th St,West 48th St,47/48 Street Block Association,,,DPR,846,8,Contact the Community Board Unit at OMB for information regarding this request.,geosupport_2_street_name,0104000020E610000001000000010100000058A2F968887F52C0F236FD13B8614440
3258,408202417C,Queens,4,08,408,QN 08,C, ,17,Senior center programs,"Reconstruct or upgrade a park or amenity (i.e. playground, outdoor athletic field)","Redesign, address drainage and electrical issues at Briarwood Playground (JHS 217). Eliminate one basketball court and create a tennis court.",Site Name: Briarwood Playground,Briarwood Playground,,,,,,,,DPR,846,5,Parks Department funds are insufficient for this purpose. We recommend this request be brought to the attention of your Council Members.,geosupport_1B_place,0104000020E6100000010000000101000000501C40BFEF7352C0F261F6B2ED5A4440
3494,412202420C,Queens,4,12,412,QN 12,C,street,20,Traffic and traffic flow,Repair or provide new street lights,additional street lighting at 183rd Street and Hillside Ave.,Street Name: 183rd St    Cross Street 1: Hillside Ave  Cross Street 2: Hillside Ave,,183rd St,183rd St,Hillside Ave,Hillside Ave,Hon. Mark Weprin,,,DOT,841,8,Please contact the Borough Commissioner's office to discuss this request.,geosupport_2_street_name,0104000020E61000000100000001010000008CA73706D97152C067160B605F5B4440
3655,501202437C,SI,5,01,501,SI 01,C, ,37,Community board facilities and staff,Other capital budget request for DEP,Upgrade sewers on Gordon Street between Laurel Avenue and Warren Street.,Street Name: Gordon Street    Cross Street 1: Laurel Avenue  Cross Street 2: Laurel Avenue,,Gordon Street,Gordon Street,Laurel Avenue,Laurel Avenue,,,,DEP,826,8,Further study by the agency of this request is needed.,geosupport_2_street_name,0104000020E61000000100000001010000004EC05850598552C03442A254534F4440
3658,501202440C,SI,5,01,501,SI 01,C, ,40,Commercial district revitalization,Repair or provide new street lights,Repair or provide new street lights - Additional street lighting on vanderbilt avenue,Street Name: vanderbilt avenue    Cross Street 1: richmond road  Cross Street 2: richmond road,,vanderbilt avenue,vanderbilt avenue,richmond road,richmond road,,,,DOT,841,10,"The Department has measured light levels at the requested location(s) and determined that they meet DOT lighting standards. Therefore, additional lighting is unnecessary at this time.",geosupport_2_street_name,0104000020E610000001000000010100000032E4B6D7948552C03F5283DE804E4440
