unique_id,tracking_code,borough,borough_code,cd,commdist,cb_label,type_br,type,priority,need,request,explanation,location,site_name,address,street_name,street_cross_1,street_cross_2,supporters_1,supporters_2,parent_tracking_code,agency_acronym,agency,agency_category_response,agency_response,geo_function,geom
835,203202439E,Brooklyn,3,03,303,BK 03,E, ,39,Housing oversight and emergency programs,"Improve traffic and pedestrian safety, including traffic calming","The Broadway corridor needs extensive improvements to traffic and pedestrian safety. The Board requests improved street markings, lighting, and traffic signaling at the intersection with Quincy Street and Gates Avenue.",Street Name: Broadway    Cross Street 1: Quincy Street  Cross Street 2: Quincy Street,,Broadway,Broadway,Quincy Street,Quincy Street,,,,DOT,841,8,Further study by the agency of this request is needed.,geosupport_2_street_name,0104000020E6100000010000000101000000EB502C32157B52C0BFA2B3EE55584440
836,203202440E,Brooklyn,3,03,303,BK 03,E,site,40,"Park, buildings, and access improvements","Improve traffic and pedestrian safety, including traffic calming","The Broadway corridor needs extensive improvements to traffic and pedestrian safety. The Board requests improved street markings, lighting, and traffic signaling and timing at the intersections with Monroe Street and Howard Avenue.",Street Name: Broadway    Cross Street 1: Monroe Street  Cross Street 2: Monroe Street,,Broadway,Broadway,Monroe Street,Monroe Street,,,,DOT,841,8,Further study by the agency of this request is needed.,geosupport_2_street_name,0104000020E6100000010000000101000000E5522E01F17A52C07D58DDF52C584440
3247,408202410C,Queens,4,08,408,QN 08,C,site,10,Park programming,"Reconstruct or upgrade a park or amenity (i.e. playground, outdoor athletic field)",Rehabilitate Flushing Meadow Corona Park and rebuild bridge over Flushing Creek at the south end of Willow Lake.,Site Name: Flushing Meadows Corona Park,Flushing Meadows Corona Park,,,,,,,,DPR,846,8,Further study by the agency of this request is needed.,geosupport_1B_place,0104000020E6100000010000000101000000CEA8F92AF97552C093C5FD47A65F4440
908,205202419C,Brooklyn,3,05,305,BK 05,C,street,19,Traffic and traffic flow,"Roadway maintenance (i.e. pothole repair, resurfacing, trench restoration, etc.)",Request for Trench Restoration on Atlantic Avenue at the intersection of Crescent Street.  Currently both sides of the roadway have large potholes and sinking pavement.,Street Name: Atlantic Avenue    Cross Street 1: Crescent Street,,Atlantic Avenue,Atlantic Avenue,Crescent Street,,,,,DOT,841,8,"Capital funding constraints, project capacity and City-wide priorities preclude this project at this time.",geosupport_2_street_name,0104000020E61000000100000001010000000AA37CAEC77752C07264B27941574440
869,204202417E,Brooklyn,3,04,304,BK 04,E, ,17,Environmental protection,Support merchant organizing,"Several years ago, joint efforts were taken to organize the merchants along the Broadway corridor. Further support and resources are critical to organizing capacity and sustainability.",Street Name: Broadway    Cross Street 1: Flushing Avenue  Cross Street 2: Flushing Avenue,,Broadway,Broadway,Flushing Avenue,Flushing Avenue,,,,SBS,801,8,The agency will try to accommodate this issue within existing resources.,geosupport_2_street_name,0104000020E61000000100000001010000002FDDA69C487C52C06A909B5FB1594440
880,205202404C,Brooklyn,3,05,305,BK 05,C, ,04,Programs to address other public health issues,Reconstruct or upgrade a building in a park,Secure funding for construction of comfort station at Lion?s Pride Playground  ? EXPLANATION: Funding has been allocated to renovate the upgrade the playground and adjacent site but a comfort station is still not included in the renovation.,"Site Name: Lions;   Street Name: Riverdale Avenue, Brooklyn, New York, NY",Lions,"Riverdale Avenue, Brooklyn, New York, NY",Riverdale Avenue,,,,,,DPR,846,5,This project has not been funded.,geosupport_1B_place,0104000020E6100000010000000101000000E9B81AD9957952C0821C9430D3544440
3539,413202415C,Queens,4,13,413,QN 13,C,site,15,"Park, buildings, and access improvements",Repair or construct new curbs or pedestrian ramps,The center median needs curbing to protect the garden and irrigation system local residents have worked very hard to keep clean and beautify.,Street Name: Francis Lewis Boulevard    Cross Street 1: 130 Avenue  Cross Street 2: 130 Avenue,,Francis Lewis Boulevard,Francis Lewis Boulevard,130 Avenue,130 Avenue,Federated Blocks of Laurelton,,,DOT,841,8,Further study by the agency of this request is needed.,geosupport_2_street_name,0104000020E61000000100000001010000001AA4D628216F52C0C4F41A8E32574440
995,207202406C,Brooklyn,3,07,307,BK 07,C,site,06,"Park, buildings, and access improvements",Invest in capital projects to improve access to waterfront,"Full funding for construction of Bush Terminal Park through Phase 2, including playground, environmental center and pier 5.  Although the park is open, EDC has not provided all the amenities promised to this community.",Site Name: Bush Terminal Park,Bush Terminal Park,,,,,,,,EDC,802,8,Further study by the agency of this request is needed.,geosupport_1B_place,0104000020E61000000100000001010000005A9F724C168152C00FB8AE9811544440
915,205202426C,Brooklyn,3,05,305,BK 05,C,street,26,Transportation infrastructure,Other capital budget request for DOT,"Cameras are still a great tool to address pedestrian safety as well as vehicular misconduct (speeding, etc.)  We are in need of cameras in specific areas of the district.",Street Name: Bradford Street    Cross Street 1: Livonia Avenue,,Bradford Street,Bradford Street,Livonia Avenue,,,,,DOT,841,10,Red Light Cameras are supported by NYCDOT; their placement locations are not disclosed to the public.  New legislation is required to implement this request.,geosupport_2_street_name,0104000020E6100000010000000101000000772AB0A5FA7852C01E1AD4E428554440
916,205202427C,Brooklyn,3,05,305,BK 05,C,street,27,Transportation infrastructure,"Improve traffic and pedestrian safety, including traffic calming","Cameras are still a great tool to address pedestrian safety as well as vehicular misconduct (speeding, etc.)  We are in need of cameras in specific areas of the district.  This request is near to I.S. 292 Middle School and Gotham ENY Health Facility",Street Name: Vermont Street    Cross Street 1: Pitkin Avenue,,Vermont Street,Vermont Street,Pitkin Avenue,,,,,DOT,841,10,Red Light Cameras are supported by NYCDOT; their placement locations are not disclosed to the public.  New legislation is required to implement this request.,geosupport_2_street_name,0104000020E6100000010000000101000000FA2EBF96367952C08529CBDB09564440
1037,207202434C,Brooklyn,3,07,307,BK 07,C, ,34,"Library facilities, equipment and programs (BPL)",Improve access to a building in a park,Replace sidewalks and curbs on East 4th Street between Ft. Hamilton Parkway and Caton Avenue at the community garden.  The adjacent property owner is NYC.,Street Name: East 4th Street    Cross Street 1: Ft. Hamilton Parkway  Cross Street 2: Ft. Hamilton Parkway,,East 4th Street,East 4th Street,Ft. Hamilton Parkway,Ft. Hamilton Parkway,,,,DPR,846,7,This project has not been funded.,geosupport_2_street_name,0104000020E6100000010000000101000000E3AEE6288F7E52C0808612480C534440
3540,413202415E,Queens,4,13,413,QN 13,E,site,15,"Park, buildings, and access improvements",Other park maintenance and safety requests,The waterways in Brookville Park need drudged and the overgrown phragmites need to be removed. This invasive species limits visibility and gives visitors concerns about their safety because they cannot be seen.,Site Name: Brookville Park,Brookville Park,,,,,,,,DPR,846,3,"The agency recommends funding this expense budget request in FY 2024, but at this time the availability of funds is uncertain.",geosupport_1B_place,0104000020E610000001000000010100000034F790F0BD6F52C01F86562767544440
3544,413202419C,Queens,4,13,413,QN 13,C, ,CS,Park maintenance and safety,"Reconstruct or upgrade a park or amenity (i.e. playground, outdoor athletic field)","Gunn Playground needs its MPAA repaved and adjacent property purchased for park expansion. (Land swap) In addition, the playground needs an upgrade. This is partially funded.",Site Name: Gunn Playground,Gunn Playground,,,,,,,,DPR,846,5,This request is partially funded. Contact the Department of Parks and Recreation for specifics.,geosupport_1B_place,0104000020E61000000100000001010000003A083A5AD56E52C0A8514832AB5D4440
999,207202408C,Brooklyn,3,07,307,BK 07,C, ,08,Traffic and traffic flow,"Reconstruct or upgrade a park or amenity (i.e. playground, outdoor athletic field)","Rehabilitate children's playground, basketball and handball courts at Greenwood Park.",Site Name: Greenwood Playground,Greenwood Playground,,,,,,,,DPR,846,2,Request includes multiple projects. Some of which are partially or fully funded.,geosupport_1B_place,0104000020E6100000010000000101000000DE04DF347D7E52C015376E313F534440
1026,207202423C,Brooklyn,3,07,307,BK 07,C, ,23,Street trees and forestry services,"Reconstruct or upgrade a park or amenity (i.e. playground, outdoor athletic field)",Rehabilitate Pena-Herrera Park.,Site Name: Pena-Herrera Park;   Street Name: 4601 3 Avenue,Pena-Herrera Park,4601 3 Avenue,3 Avenue,,,,,,DPR,846,1,This capital project is included in the agency's departmental estimates for FY 2024. For details check the FY 2024 Preliminary Budget Statement for Capital Projects and/or the current Commitment Plan.,geosupport_1B_address,0104000020E610000001000000010100000082E50819C88052C0FBE769C020534440
1041,207202438C,Brooklyn,3,07,307,BK 07,C,street,38,Transportation infrastructure,"Reconstruct or upgrade a park or amenity (i.e. playground, outdoor athletic field)",Rehabilitate the portion of John Allen Payne Park that has not already been rehabilitated,Site Name: John Allen Payne Park,John Allen Payne Park,,,,,,,,DPR,846,5,This project has not been funded.,geosupport_1B_place,0104000020E6100000010000000101000000A33D5E48878152C0B8B1D991EA514440
1055,209202432C,Brooklyn,3,09,309,BK 09,C, ,32,Garbage collection and recycling,Inspect sanitary sewer on specific street segment and repair or replace as needed,Several residents have experienced serious basement flooding which may have been caused by clogged sewers.,Street Name: Midwood Street    Cross Street 1: Bedford Avenue  Cross Street 2: Bedford Avenue,,Midwood Street,Midwood Street,Bedford Avenue,Bedford Avenue,,,,DEP,826,8,Further study by the agency of this request is needed.,geosupport_2_street_name,0104000020E61000000100000001010000002C188C323C7D52C00FDD90F671544440
1066,211202426C,Brooklyn,3,11,311,BK 11,C,site,26,"Park, buildings, and access improvements",Inspect sanitary sewer on specific street segment and repair or replace as needed,"Study and planning to reconstruct Shore Parkway from Bay 20th Street to Bay 8th Street. This segment of the roadway has cave-ins along the sewer-line in the center roadway. While televising has been completed, planning needs to be initiated to address flooding, drainage and roadway integrity. Capital Project SE883, addresses the area of Shore Parkway from 21 Avenue to Bay 20th Street.",Street Name: Shore Parkway    Cross Street 1: Bay 8 Street  Cross Street 2: Bay 8 Street,,Shore Parkway,Shore Parkway,Bay 8 Street,Bay 8 Street,,,,DEP,826,9,This project is included in the ten-year plan.,geosupport_2_street_name,0104000020E6100000010000000101000000518CC1BB2A8152C08409CB6E534D4440
1115,208202425C,Brooklyn,3,08,308,BK 08,C, ,CS,After school programs,Provide a new or expand an existing middle/intermediate school,"We thank the DOE and SCA to agree to create a designated District 13 middle school in the B15 building of the Atlantic Yards/Pacific Park Development. We look forward to the school's design and completion, and the great impact it will have on the parents of middle school students in Prospect Heights.",Site Name: B15 building;   Street Name: 37 Sixth Avenue,B15 building,37 Sixth Avenue,Sixth Avenue,,,,,,DOE,40,9,This request has already been funded.,geosupport_1B_address,0104000020E610000001000000010100000082A966D6527E52C00C76C3B645574440
1295,211202404C,Brooklyn,3,11,311,BK 11,C, ,04,Environmental protection,Other capital budget request for DEP,"Fund study and planning to address possible faults of Regulator 9A. Strong sewer odors are escaping the vault, which are permeating the Bath Beach community.",Street Name: Bay 16 Street    Cross Street 1: Bath Avenue  Cross Street 2: Bath Avenue,,Bay 16 Street,Bay 16 Street,Bath Avenue,Bath Avenue,,,,DEP,826,8,Further study by the agency of this request is needed.,geosupport_2_street_name,0104000020E6100000010000000101000000A0E23DE97C8052C0151DCF0E694D4440
1085,208202410C,Brooklyn,3,08,308,BK 08,C, ,10,Services for vulnerable New Yorkers,"Reconstruct or upgrade a park or amenity (i.e. playground, outdoor athletic field)","The skate park at Brower park is in dire need of refurbishment. Users cite an uneven and pitted ground that makes it impossible to skate safely, thus creating an immediate hazardous condition. Additionally, users cite awkward features/obstacles leaving no room to skate comfortably.   The following suggestions have been provided to improve the skate park: 1. Repave the ground to be exactly like that of the basketball court. 2. Open the center and leave free of features/obstacles for acceleration/deceleration and free skating on flat ground. 3. Line the perimeter of the skate park with the same height and style ledges as the basketball courts. 4. Use a strong cement or granite for all features, obstacles, and ledges to withstand skating and BMX pegs.",Site Name: Brower Park,Brower Park,,,,,,,,DPR,846,8,This project has not been funded.,geosupport_1B_place,0104000020E6100000010000000101000000ADA7565F5D7C52C0DF8AC40435564440
1099,208202417C,Brooklyn,3,08,308,BK 08,C, ,17,Cultural facilities and resources,"Reconstruct or upgrade a park or amenity (i.e. playground, outdoor athletic field)","Completely reconstruct playground at James Forten Playground (formerly Underhill Playground) including all new play equipment, new safety surface, sitting areas, landscaping, spray showers.",Site Name: James Forten Playground (formerly Underhill Playground),James Forten Playground (formerly Underhill Playground),,,,,,,,DPR,846,5,This project has not been funded.,geosupport_1B_place,0104000020E6100000010000000101000000C6C1A563CE7D52C0B6300BED9C564440
1143,209202410C,Brooklyn,3,09,309,BK 09,C, ,10,Youth workforce development,Renovate or upgrade a senior center,"St. Gabriel's Senior Center is need of a furniture upgrade. The facility needs to replace tables, chairs and refrigerator. The center is also in need tech upgrades such as media carts, laptop tables, desks and smart boards.","Site Name: St. Gabriel's Senior Center;   Street Name: 331 Hawthorne Street, Brooklyn, New York, NY",St. Gabriel's Senior Center,"331 Hawthorne Street, Brooklyn, New York, NY",Hawthorne Street,,,Hon. Mathieu Eugene,,,DFTA,125,8,Further study by the agency of this request is needed.,geosupport_1B_address,0104000020E6100000010000000101000000B0FECF61BE7C52C0BBD1C77C40544440
1145,209202411C,Brooklyn,3,09,309,BK 09,C,site,11,Transit Infrastructure,"Roadway maintenance (i.e. pothole repair, resurfacing, trench restoration, etc.)","Expedite a joint DOT and DEP capital project for the reconstruction of Midwood Street to create a high functioning drainage system and improve road surface. There is a longstanding severe ponding and street flooding condition that becomes hazardous for pedestrians and motorists alike during the winter months when the road becomes icy as a result of the water pooling. The resurfacing, drainage, and sewer support system must be addressed in a systematic manner. The area lacks proper drainage and the location needs to be investigated by both DEP and DOT",Street Name: Midwood Street    Cross Street 1: Utica Avenue  Cross Street 2: Utica Avenue,,Midwood Street,Midwood Street,Utica Avenue,Utica Avenue,Hon. Alicka Ampry-Samuel,,,DOT,841,3,"Capital funding constraints, project capacity and City-wide priorities preclude this project at this time.",geosupport_2_street_name,0104000020E6100000010000000101000000E4635D259C7B52C06AC5AE71A6544440
1166,209202423C,Brooklyn,3,09,309,BK 09,C,site,23,Transit Service,"Improve traffic and pedestrian safety, including traffic calming","Although the speed limit has been reduced to 25 mph, motorists are still speeding throughout the district. Additional traffic enforcement cameras are necessary to alleviate this problem.",Street Name: Rogers Avenue    Cross Street 1: Lefferts Avenue  Cross Street 2: Lefferts Avenue,,Rogers Avenue,Rogers Avenue,Lefferts Avenue,Lefferts Avenue,Hon. Mathieu Eugene,,,DOT,841,5,Red Light Cameras are supported by NYCDOT; their placement locations are not disclosed to the public.  New legislation is required to implement this request.,geosupport_2_street_name,0104000020E610000001000000010100000022F58D71097D52C0BBB0A626C2544440
1147,209202412C,Brooklyn,3,09,309,BK 09,C, ,12,Affordable housing programs,"Roadway maintenance (i.e. pothole repair, resurfacing, trench restoration, etc.)",Many streets in Community District 9 are in need of resurfacing due to damages caused by winter salting and general wear and tear. Community District 9 would like to see an increase in the district's asphalt allocation and the number of streets that are resurfaced. In particular Lincoln Road is a street within the District that has been in need of repaving for a number of years. There are large dips and potholes on the road that are hazardous conditions even for motorists that are familiar with the road but at times find themselves having to abruptly swerve in order to avoid potential damages to their vehicles by driving through the dips and potholes.,Street Name: Lincoln Road    Cross Street 1: Bedford Avenue  Cross Street 2: Bedford Avenue,,Lincoln Road,Lincoln Road,Bedford Avenue,Bedford Avenue,Hon. Mathieu Eugene,,,DOT,841,7,More information is needed from the community board before making a funding decision. The community board should contact the agency.,geosupport_2_street_name,0104000020E61000000100000001010000006FC3C8C73E7D52C0EA85398BA1544440
1153,209202415C,Brooklyn,3,09,309,BK 09,C, ,15,Building code and zoning enforcement,"Improve traffic and pedestrian safety, including traffic calming","Ocean Avenue between Flatbush and Parkside Avenues needs traffic calming interventions. While the street is scheduled for major reconstruction with the addition of a bike lane, that may now be years away. In addition, there are five signalized street crossings all leading to the park?s entrances. They are all dangerous and should have more pedestrian refuges and other considerations. Two of the signalized crossings are not intersections; drivers ignore red signals every time the light changes. Drivers make illegal U-turns, and there is excessive speeding. The parking lane is used as a travel lane during rush hours, and was the reason for moving the planned bike lane onto the expanded sidewalk. But there is no enforcement during the afternoon rush and therefore can be a protected bike lanes",Street Name: Ocean Avenue    Cross Street 1: Flatbush Avenue  Cross Street 2: Flatbush Avenue,,Ocean Avenue,Ocean Avenue,Flatbush Avenue,Flatbush Avenue,Hon. Mathieu Eugene,,,DOT,841,7,More information is needed from the community board before making a funding decision. The community board should contact the agency.,geosupport_2_street_name,0104000020E61000000100000001010000003A8AB9C1977D52C01E697C1DE0544440
1178,209202429C,Brooklyn,3,09,309,BK 09,C, ,29,Cultural facilities and resources,Inspect sanitary sewer on specific street segment and repair or replace as needed,Several residents have experienced serious basement flooding which may have been caused by clogged sewers.,Street Name: Fenimore Street    Cross Street 1: Bedford Avenue  Cross Street 2: Bedford Avenue,,Fenimore Street,Fenimore Street,Bedford Avenue,Bedford Avenue,,,,DEP,826,8,Further study by the agency of this request is needed.,geosupport_2_street_name,0104000020E6100000010000000101000000C9AD7DBB397D52C0A71E335F43544440
1155,209202416C,Brooklyn,3,09,309,BK 09,C, ,16,Tax and other incentives programs and financing support,"Improve traffic and pedestrian safety, including traffic calming","The three-year wait time period for speed hump installations, stop sign requests, midblock crossing requests and other traffic calming and pedestrian safety proposals must be decreased. DOT should be required to conduct district-wide traffic calming study to improve safety, particularly around known or identified speeding areas, and to understand how implementation of all or any combination of traffic calming requests would impact traffic flow in the District, instead of considering the impact on a block-by-block basis, as they are requested. Additionally, All Way crossings signals at intersections should be implemented in some heavily used areas to allow pedestrians time and space to cross the street. Truck routes throughout the District needs to be included in the study.",Street Name: Lefferts Avenue    Cross Street 1: Bedford Avenue  Cross Street 2: Bedford Avenue,,Lefferts Avenue,Lefferts Avenue,Bedford Avenue,Bedford Avenue,Hon. Mathieu Eugene,,,DOT,841,7,More information is needed from the community board before making a funding decision. The community board should contact the agency.,geosupport_2_street_name,0104000020E6100000010000000101000000E06D7D30407D52C0772A9C44BB544440
1157,209202417C,Brooklyn,3,09,309,BK 09,C, ,17,Tax and other incentives programs and financing support,"Improve traffic and pedestrian safety, including traffic calming","The three-year wait time period for speed hump installations, stop sign requests, midblock crossing requests and other traffic calming and pedestrian safety proposals must be decreased. DOT should be required to conduct district-wide traffic calming study to improve safety, particularly around known or identified speeding areas, and to understand how implementation of all or any combination of traffic calming requests would impact traffic flow in the District, instead of considering the impact on a block-by-block basis, as they are requested. Additionally, All Way crossings signals at intersections should be implemented in some heavily used areas to allow pedestrians time and space to cross the street. Truck routes throughout the District needs to be included in the study.",Street Name: Winthrop Street    Cross Street 1: Troy Avenue  Cross Street 2: Troy Avenue,,Winthrop Street,Winthrop Street,Troy Avenue,Troy Avenue,Hon. Alicka Ampry-Samuel,,,DOT,841,7,More information is needed from the community board before making a funding decision. The community board should contact the agency.,geosupport_2_street_name,0104000020E61000000100000001010000005B1C259BF57B52C095102C7837544440
1164,209202422C,Brooklyn,3,09,309,BK 09,C,street,22,Traffic and traffic flow,"Improve traffic and pedestrian safety, including traffic calming","Although the speed limit has been reduced to 25 mph, motorists are still speeding throughout the district. Additional traffic enforcement cameras are necessary to alleviate this problem.",Street Name: Washington Avenue    Cross Street 1: Montgomery Street  Cross Street 2: Montgomery Street,,Washington Avenue,Washington Avenue,Montgomery Street,Montgomery Street,Hon. Laurie A. Cumbo,,,DOT,841,3,Red Light Cameras are supported by NYCDOT; their placement locations are not disclosed to the public.  New legislation is required to implement this request.,geosupport_2_street_name,0104000020E610000001000000010100000028DDD8248B7D52C02F54084A56554440
1168,209202424C,Brooklyn,3,09,309,BK 09,C,site,24,Traffic and traffic flow,"Improve traffic and pedestrian safety, including traffic calming","Although the speed limit has been reduced to 25 mph, motorists are still speeding throughout the district. Additional traffic enforcement cameras are necessary to alleviate this problem.",Street Name: Winthrop Avenue    Cross Street 1: Troy Avenue  Cross Street 2: Troy Avenue,,Winthrop Avenue,Winthrop Avenue,Troy Avenue,Troy Avenue,Hon. Alicka Ampry-Samuel,,,DOT,841,5,Red Light Cameras are supported by NYCDOT; their placement locations are not disclosed to the public.  New legislation is required to implement this request.,geosupport_2_street_name,0104000020E61000000100000001010000005B1C259BF57B52C095102C7837544440
1188,209202435E,Brooklyn,3,09,309,BK 09,E,street,35,Traffic and traffic flow,"Enhance park safety through design interventions, e.g. better lighting",Installation of additional lighting to deter illegal activities,"Site Name: Dodger Playground;   Street Name: Sullivan Place, Brooklyn, New York, NY",Dodger Playground,"Sullivan Place, Brooklyn, New York, NY","Sullivan Place, Brooklyn, New York, NY",,,Hon. Laurie  A. Cumbo,,,DPR,846,5,This project has not been funded.,geosupport_1B_place,0104000020E6100000010000000101000000A1F48590F37C52C0B70BCD751A554440
3489,412202415C,Queens,4,12,412,QN 12,C, ,15,Park programming,Repair or provide new street lights,Install brighter lights at Hillside Ave and Sutphin Blvd.  Install additional lighting,Street Name: Hillside Ave    Cross Street 1: Sutphin Blvd  Cross Street 2: Sutphin Blvd,,Hillside Ave,Hillside Ave,Sutphin Blvd,Sutphin Blvd,Hon. Rory Lancman,,,DOT,841,8,Please contact the Borough Commissioner's office to discuss this request.,geosupport_2_street_name,0104000020E61000000100000001010000009138D8F1D17352C0CD8953E0555A4440
